-- phpMyAdmin SQL Dump
-- version 4.7.7
-- https://www.phpmyadmin.net/
--
-- Host: localhost:3306
-- Generation Time: Sep 10, 2018 at 04:16 PM
-- Server version: 10.0.36-MariaDB
-- PHP Version: 5.6.30

SET SQL_MODE = "NO_AUTO_VALUE_ON_ZERO";
SET AUTOCOMMIT = 0;
START TRANSACTION;
SET time_zone = "+00:00";


/*!40101 SET @OLD_CHARACTER_SET_CLIENT=@@CHARACTER_SET_CLIENT */;
/*!40101 SET @OLD_CHARACTER_SET_RESULTS=@@CHARACTER_SET_RESULTS */;
/*!40101 SET @OLD_COLLATION_CONNECTION=@@COLLATION_CONNECTION */;
/*!40101 SET NAMES utf8mb4 */;

--
-- Database: `colvenierbe_colvftp1`
--

-- --------------------------------------------------------

--
-- Table structure for table `admin`
--

CREATE TABLE `admin` (
  `admin_id` int(10) UNSIGNED NOT NULL,
  `admin_name` varchar(50) NOT NULL,
  `password` varchar(50) NOT NULL
) ENGINE=MyISAM DEFAULT CHARSET=latin1;

--
-- Dumping data for table `admin`
--

INSERT INTO `admin` (`admin_id`, `admin_name`, `password`) VALUES
(1, 'admin', '6c84cbd30cf9350a990bad2bcc1bec5f');

-- --------------------------------------------------------

--
-- Table structure for table `availability`
--

CREATE TABLE `availability` (
  `availability_id` int(10) UNSIGNED NOT NULL,
  `no_person` varchar(255) NOT NULL,
  `dinner_date` varchar(255) NOT NULL,
  `dinner_hr` varchar(255) NOT NULL,
  `email_id` varchar(255) NOT NULL,
  `is_available` int(11) NOT NULL,
  `is_email` int(11) NOT NULL,
  `entrydate` datetime NOT NULL,
  `refurl` text NOT NULL
) ENGINE=MyISAM DEFAULT CHARSET=latin1;

--
-- Dumping data for table `availability`
--

INSERT INTO `availability` (`availability_id`, `no_person`, `dinner_date`, `dinner_hr`, `email_id`, `is_available`, `is_email`, `entrydate`, `refurl`) VALUES
(1054, '2', '03/06/2015', '20u', 'marc.brokken@skynet.be', 1, 0, '2015-05-25 15:49:21', 'http://www.colvenier.be/'),
(1053, '2', '05/06/2015', '20u', 'marc.brokken@skynet.be', 1, 0, '2015-05-25 15:47:16', 'http://www.colvenier.be/index.php'),
(1052, '9', '13 juni', '9', 'jeroen.hoftijzer@gmail.com', 0, 0, '2015-05-25 11:27:14', 'http://www.colvenier.be/'),
(1051, '12', '26 mei', 'daemspatricia@gmail.com', '4', 0, 0, '2015-05-24 19:27:17', 'http://www.colvenier.be/menu.htm'),
(1050, '2', '25 05 2015', '1300', 'luc.malfliet@telenet.be', 0, 0, '2015-05-23 19:20:27', 'http://www.colvenier.be/index.php'),
(1049, '19', '30 mei 2015', 'verhe_ma@yahoo.com', '4', 0, 0, '2015-05-23 13:36:00', 'http://www.colvenier.be/menu.htm'),
(1048, '2', '23-05-2015', '19:00', 'vandijkwannes@gmail.com', 0, 0, '2015-05-23 10:53:57', 'http://www.colvenier.be/unieke_belevenis.htm'),
(1047, '2', '23 mei ', '19u', 'hugoverberckmoes@hotmail.com', 0, 0, '2015-05-23 05:40:18', 'http://www.colvenier.be/index.php'),
(1046, '2', '23 mei 2015', '20.00', 'xsynto@gmail.com', 0, 0, '2015-05-21 13:11:32', 'http://www.colvenier.be/'),
(1044, '20', '20-05-2015', 'amazon66@skynet.be', '2', 0, 0, '2015-05-19 23:21:54', 'http://www.colvenier.be/menu.htm'),
(1045, '2', '22/5/2015', '19u30', 'goossens.bob@gmail.com', 0, 0, '2015-05-20 21:09:33', 'http://www.colvenier.be/'),
(1043, '2', '29 mei', '19 uur', 'patinne@skynet.be', 0, 0, '2015-05-19 21:08:59', 'http://www.colvenier.be/'),
(1042, '2', '22/05/2015', '19u30', 'goossens.bob@gmail.com', 0, 0, '2015-05-19 18:46:14', 'http://www.colvenier.be/'),
(1041, '19', '15/06/2015', 'hakan.quintelier@hotmail.com', '4', 0, 0, '2015-05-19 17:25:39', 'http://www.colvenier.be/menu.htm'),
(1040, '4', '19/05/2015', '19.00', 'marcmelis@skynet.be', 1, 0, '2015-05-18 20:47:23', 'http://www.colvenier.be/'),
(1039, '20', '23/05/2015', 'fons39@hotmail.com', '7', 0, 0, '2015-05-18 16:46:25', 'http://www.colvenier.be/menu.htm'),
(1038, '6', '30052015', '13', 'marleen.haegeman@hotmail.com', 0, 0, '2015-05-18 10:37:44', 'http://www.colvenier.be/'),
(1037, '4', '23/05/2015', '20u', 'viviane.keysers@csmbakerysolutions.com', 0, 0, '2015-05-18 06:28:14', 'http://www.colvenier.be/'),
(1035, '19', '17/5/2015', 'tky338@hotmail.com', '2', 0, 0, '2015-05-17 16:15:45', 'http://www.colvenier.be/menu.htm'),
(1036, '2', '04/07/2015', '19u', 'a@gmail.com', 0, 0, '2015-05-17 21:56:50', 'http://www.colvenier.be/'),
(1034, '19', '17/5/2015', 'tky338@hotmail.com', '2', 0, 0, '2015-05-17 16:11:33', 'http://www.colvenier.be/menu.htm'),
(1033, '19', '17/5/2015', 'tky338@hotmail.com', '2', 0, 0, '2015-05-17 15:30:19', 'http://www.colvenier.be/menu.htm'),
(1032, '19', '17/5/2015', 'tky338@hotmail.com', '2', 0, 0, '2015-05-17 15:25:28', 'http://www.colvenier.be/menu.htm'),
(1031, '4', '21.05.2015', '19h00', 'andre.balliauw@telenet.be', 1, 0, '2015-05-17 10:40:53', 'http://www.colvenier.be/unieke_belevenis.htm'),
(1030, '3', '30052015', '13', 'marleen.haegeman@hotmail.com', 0, 0, '2015-05-16 20:01:50', 'http://www.colvenier.be/unieke_belevenis.htm'),
(1029, '19', 'maandag 1 juni', 't.willemse@telenet.be', '2', 0, 0, '2015-05-16 17:48:38', 'http://www.colvenier.be/menu.htm'),
(1028, '4', '24 mei 2015', '18.30', 'ckoenen@gericare.nl', 1, 0, '2015-05-16 15:07:20', 'http://www.colvenier.be/index.php'),
(1027, '4', '23 mei 20015', '18.30 uur', 'coert.koenen@gmail.com', 0, 0, '2015-05-16 14:58:17', 'http://www.colvenier.be/'),
(1026, '2', '16 mei', '19.30', 'huub@comafin.nl', 0, 0, '2015-05-16 11:46:03', 'http://www.colvenier.be/index.php'),
(1025, '2', '15/05/2015', '20:00u', 'frederik@b-surgery.com', 1, 0, '2015-05-15 17:17:36', 'http://www.colvenier.be/unieke_belevenis.htm'),
(1024, '2', '16/5/2015', '20u00', 'ed@vpd.eu', 0, 0, '2015-05-15 14:49:10', 'http://www.colvenier.be/?utm_source=truvo&utm_medium=internet&utm_campaign=goudengidspagesdor'),
(1022, '4', '16/05/2015', '8', 'Rogerdekeyser@base.be', 1, 0, '2015-05-14 18:15:42', 'http://www.colvenier.be/'),
(1023, '4', '20-06-2015', '19u', 'jammmar@pandora.be', 1, 0, '2015-05-14 22:44:17', 'http://www.colvenier.be/'),
(1021, '2', '15 mei', '20.00', 'e.vanteeseling@albeda.nl', 1, 0, '2015-05-13 09:50:11', 'http://www.colvenier.be/'),
(1020, '2', '15/5/2015', '19.00', 'LINKERPINKSKE@GMAIL.COM', 1, 0, '2015-05-12 11:40:17', 'http://www.colvenier.be/index.php'),
(1019, '4', '12/05/2015', '18.00', 'gerda.vangenechten@guehring.be', 0, 0, '2015-05-12 10:57:52', 'http://www.colvenier.be/'),
(1018, '4', '19.6', '12', 'w.ja@skynet.be', 0, 0, '2015-05-12 10:57:34', 'http://www.colvenier.be/unieke_belevenis.htm'),
(1017, '7', '31/05/2015', '13', 'jirka.van.haudt@skynet.be', 0, 0, '2015-05-12 10:35:07', 'http://www.colvenier.be/'),
(1016, '2', '13/05/2015', '19.00', 'ortwin.kloeck@zoetis.com', 0, 0, '2015-05-12 09:27:31', 'http://www.colvenier.be/'),
(1015, '20', '12/05/2015', 'paul.vanderstraate@live.be', '2', 0, 0, '2015-05-12 07:26:27', 'http://www.colvenier.be/menu.htm'),
(1014, '4', '19/06/2015', '12.00', 'w.ja@skynet.be', 0, 0, '2015-05-11 11:03:56', 'http://www.colvenier.be/'),
(1013, '4', '19-06-2015', '19u', 'jammmar@pandora.be', 1, 0, '2015-05-10 21:43:55', 'http://www.colvenier.be/unieke_belevenis.htm'),
(1012, '20', '13-06-2015', 'dekeulenaerhans@gmail.com', '10', 0, 0, '2015-05-09 16:46:05', 'http://www.colvenier.be/menu.htm'),
(1011, '4', '10.05.2015 ', '12 h', 'monique.geyskens@telenet.be', 1, 0, '2015-05-09 13:48:45', 'http://www.colvenier.be/'),
(1010, '2', '8-5-15', '13 UUR', 'INFO@IRICOSA.COM', 0, 0, '2015-05-08 18:30:09', 'http://www.colvenier.be/'),
(1009, '20', '09-05-2015', 'lassche1@planet.nl', '2', 0, 0, '2015-05-08 13:02:23', 'http://www.colvenier.be/menu.htm'),
(1008, '2', 'zaterdag 9 mei', '19 uur', 'nicand@skynet.be', 1, 0, '2015-05-08 12:49:36', 'http://www.colvenier.be/'),
(1007, '4', '25-7-15', '19.00', 'miekepostma@rprelektrotechniek.nl', 1, 0, '2015-05-08 11:54:33', 'http://www.colvenier.be/'),
(1006, '2', '15 MEI', '19:00', 'marinabreukelaar@gmail.com', 1, 0, '2015-05-08 10:36:05', 'http://www.colvenier.be/index.php'),
(1004, '19', '16-05-2015', 'isabelle.steyls@telenet.be', '2', 0, 0, '2015-05-06 23:43:36', 'http://www.colvenier.be/menu.htm'),
(1005, '18', '23/05/2015', 'luc.weyns@skynet.be', '4', 0, 0, '2015-05-07 11:18:32', 'http://www.colvenier.be/menu.htm'),
(1003, '6', '22/5/15', '19:00', 'stephan.hoste@pa-ats.com', 0, 0, '2015-05-06 21:44:57', 'http://www.colvenier.be/'),
(1002, '2', '7-5-15', '13', 'walter_bogaerts@skynet.be', 1, 0, '2015-05-06 18:12:49', 'http://www.colvenier.be/'),
(1001, '13', '7-5-15', 'walter_bogaerts@skynet.be', '2', 0, 0, '2015-05-06 18:05:37', 'http://www.colvenier.be/menu.htm'),
(1000, '2', '22/05/2015', '19.00u', 'elkebeyers@hotmail.com', 0, 0, '2015-05-05 23:38:20', 'http://www.colvenier.be/'),
(999, '13', '22 mei', 'christinedebruyne@telenet.be', '2', 0, 0, '2015-05-04 17:01:35', 'http://www.colvenier.be/menu.htm?utm_source=colvenier&utm_medium=email&utm_campaign=0315'),
(998, '12', '07/06/2015', 'germa@euphonynet.be', '8', 0, 0, '2015-05-04 16:24:57', 'http://www.colvenier.be/menu.htm'),
(997, '2', '09/05/2015', '19', 'davy.vanneyen@woonhaven.be', 0, 0, '2015-05-04 12:34:48', 'http://www.colvenier.be/index.php'),
(996, '2', '10 mei', '18.00', 'bwbergsma@gmail.com', 0, 0, '2015-05-03 19:21:23', 'http://www.colvenier.be/unieke_belevenis.htm'),
(995, '2', '10 mei', '18.00', 'bwbergsma@gmail.com', 0, 0, '2015-05-03 19:17:28', 'http://www.colvenier.be/index.php'),
(994, '26', '13.05.2015', '13:00', 'info@aha-reisen.de', 1, 0, '2015-05-03 11:04:46', 'http://www.colvenier.be/'),
(993, '4', '13/5', '19h30', 'E.Mandemaker@it-pillar.be', 1, 0, '2015-05-02 11:15:17', 'http://www.colvenier.be/'),
(992, '7', '10 mei', '18 u', 'norapollet@skynet.be', 0, 0, '2015-05-02 10:44:03', 'http://www.colvenier.be/'),
(991, '2', '13/05/2015', '19.00 h', 'wstessens@taurus.be', 1, 0, '2015-05-01 14:38:13', 'http://www.colvenier.be/'),
(990, '19', '01052015', 'koenstroobants@hotmail.com', '2', 0, 0, '2015-05-01 14:34:58', 'http://www.colvenier.be/menu.htm'),
(989, '6', '02/05/2015', '19H00', 'benny.serrien@proximus.com', 1, 0, '2015-05-01 12:22:17', 'http://www.colvenier.be/?utm_source=colvenier&utm_medium=email&utm_campaign=0315'),
(988, '18', '5 juni 2015', 'jozef.deproft@belgacom.net', '4', 0, 0, '2015-04-30 17:15:51', 'http://www.colvenier.be/menu.htm?utm_source=colvenier&utm_medium=email&utm_campaign=0315'),
(987, '7', '19 mei 2015', '20.00 uur', 'p.nierop@jumbomaritime.nl', 1, 0, '2015-04-30 15:22:32', 'http://www.colvenier.be/index.php'),
(986, '19', 'vrijdag 1 mei', 'paulenaggie@telenet.be', '2', 0, 0, '2015-04-30 13:40:14', 'http://www.colvenier.be/menu.htm?utm_source=colvenier&utm_medium=email&utm_campaign=0315'),
(985, '4', '9/5/2015', '20', 'vincent@vandamme-invest.be', 1, 0, '2015-04-30 13:03:48', 'http://www.colvenier.be/index.php'),
(984, '2', '02/05/2015', '20u', 'victoriavr@hotmail.com', 1, 0, '2015-04-29 21:06:30', 'http://www.colvenier.be/index.php'),
(983, '2', '14 mei', '18.00', 'pvdrunen@gmail.com', 1, 0, '2015-04-29 20:26:36', 'http://www.colvenier.be/'),
(982, '2', '16 mei', '20.00', 'lon.veen@online.nl', 1, 0, '2015-04-29 17:40:52', 'http://www.colvenier.be/'),
(980, '19', '2 mei', 'koen.van.de.vondel@telenet.be', '2', 0, 0, '2015-04-29 17:29:04', 'http://www.colvenier.be/menu.htm?utm_source=colvenier&utm_medium=email&utm_campaign=0315'),
(981, '19', '2/5', 'koen.van.de.vondel@telenet.be', '2', 0, 0, '2015-04-29 17:30:25', 'http://www.colvenier.be/menu.htm?utm_source=colvenier&utm_medium=email&utm_campaign=0315'),
(979, '19', 'zaterdag 2 mei', 'koen.van.de.vondel@telenet.be', '2', 0, 0, '2015-04-29 17:28:13', 'http://www.colvenier.be/menu.htm?utm_source=colvenier&utm_medium=email&utm_campaign=0315'),
(978, '14', '2 mei 2015', 'martinheyligen@hotmail.com', '2', 0, 0, '2015-04-29 16:58:38', 'http://www.colvenier.be/menu.htm?utm_source=colvenier&utm_medium=email&utm_campaign=0315'),
(977, '4', '25-7-2015', '20.00', 'miekepostma@rprelektrotechniek.nl', 1, 0, '2015-04-29 15:24:17', 'http://www.colvenier.be/'),
(976, '4', '05/06/2015', '19.00', 'kristof.smets@telenet.be', 1, 0, '2015-04-29 12:59:12', 'http://www.colvenier.be/'),
(975, '4', '16 mei 2015', '19u', 'luc.de.colvenaer@skynet.be', 1, 0, '2015-04-29 12:23:35', 'http://www.colvenier.be/index.php'),
(974, '4', '30 mei 2015', '19u', 'luc.de.colvenaer@skynet.be', 1, 0, '2015-04-29 12:23:24', 'http://www.colvenier.be/index.php'),
(973, '4', '23 mei 2015', '19u', 'luc.de.colvenaer@skynet.be', 1, 0, '2015-04-29 12:23:03', 'http://www.colvenier.be/index.php'),
(972, '14', '29-4', 'info@tervenne.be', '2', 0, 0, '2015-04-29 12:09:05', 'http://www.colvenier.be/menu.htm'),
(971, '19', '29-042015', 'bert.meulblok@gmail.com', '2', 0, 0, '2015-04-29 11:28:07', 'http://www.colvenier.be/menu.htm'),
(970, '4', '02/05/2015', '18.00', 'info@zagerijverbeek.be', 0, 0, '2015-04-29 10:37:07', 'http://www.colvenier.be/'),
(969, '4', '01/05/2015', '18.00', 'info@zagerijverbeek.be', 0, 0, '2015-04-29 10:36:52', 'http://www.colvenier.be/'),
(968, '2', '17 mei', '20.00', 'l.mulkens@online.nl', 1, 0, '2015-04-29 10:19:31', 'http://www.colvenier.be/'),
(967, '2', '15/04/2015', '20h30', 'jackbasset@free.fr', 1, 0, '2015-04-29 08:21:27', 'http://www.colvenier.be/unieke_belevenis.htm'),
(966, '18', '5/5', 'hugo.spooren@skynet.be', '2', 0, 0, '2015-04-28 22:48:59', 'http://www.colvenier.be/menu.htm?utm_source=colvenier&utm_medium=email&utm_campaign=0315'),
(965, '50', '11-07-2015', '19.00 uur', 'c.vorst@Planet.nl', 0, 0, '2015-04-28 21:52:10', 'http://www.colvenier.be/unieke_belevenis.htm'),
(964, '19', 'zaterdag 2 mei', 'deckers.guy@me.com', '3', 0, 0, '2015-04-28 20:56:59', 'http://www.colvenier.be/menu.htm?utm_source=colvenier&utm_medium=email&utm_campaign=0315'),
(963, '12', '13052015', 'claire.de.mere@telent.br', '2', 0, 0, '2015-04-28 19:29:08', 'http://www.colvenier.be/menu.htm?utm_source=colvenier&utm_medium=email&utm_campaign=0315'),
(962, '19', '08-05-2015', 'bertvdb@telenet.be', '2', 0, 0, '2015-04-28 18:03:41', 'http://www.colvenier.be/menu.htm?utm_source=colvenier&utm_medium=email&utm_campaign=0315'),
(961, '12', '23/5/2015', 'antony.nuitten@telenet.be', '2', 0, 0, '2015-04-28 18:00:16', 'http://www.colvenier.be/menu.htm?utm_source=colvenier&utm_medium=email&utm_campaign=0315'),
(960, '4', '9 mei 2015', '18 u', 'rudi.van.och@telenet.be', 1, 0, '2015-04-28 16:47:35', 'http://www.colvenier.be/unieke_belevenis.htm'),
(959, '2', '28april 2015', '18 u', 'rudi.van.och@telenet.be', 1, 0, '2015-04-28 16:44:46', 'http://www.colvenier.be/unieke_belevenis.htm'),
(958, '3', '1 mei 2015', '12:30', 'lievedeweerdt@yahoo.co.uk', 0, 0, '2015-04-28 14:09:55', 'http://www.colvenier.be/index.php'),
(957, '0', 'srth', 'rsthsrth', 'rsthrtsh@ddd.com', 0, 0, '2015-04-28 13:51:44', 'http://www.colvenier.be/'),
(956, '0', 'sd', 'sdvsv@ddd.com', 'rth', 0, 0, '2015-04-28 13:50:00', 'http://www.colvenier.be/menu.htm'),
(955, '0', 'zf', 'fzfzef@ddd.com', 'zef', 0, 0, '2015-04-28 13:49:14', 'http://www.colvenier.be/menu.htm'),
(954, '2', '21 juni', '13 uur', 'ilsemeersseman@hotmail.com', 0, 0, '2015-04-27 15:48:57', 'http://www.colvenier.be/'),
(953, '4', '24 april 2015', '19 00 u', 'monique1.van.den.eyndeq@skynet.be', 0, 0, '2015-04-23 22:57:13', 'http://www.colvenier.be/'),
(952, '4', '14.05.2015', '1900', 'svetlana18@skynet.be', 0, 0, '2015-04-23 18:30:40', 'http://www.colvenier.be/unieke_belevenis.htm'),
(951, '2', '24 april 2015', '12;30 uur', 'gc@gcvanhest.nl', 0, 0, '2015-04-22 20:01:21', 'http://www.colvenier.be/'),
(950, '2', '6 mei 2015', '12u30', 'jacques.cardon@skynet.be', 0, 0, '2015-04-22 11:44:14', 'http://www.colvenier.be/index.php'),
(949, '2', '19 april', '18.30', 'gertvandeneynde@yahoo.com', 0, 0, '2015-04-19 11:06:24', 'http://www.colvenier.be/unieke_belevenis.htm'),
(948, '2', '25 april', '19.30', 'jessica_vd_v@hotmail.com', 0, 0, '2015-04-17 19:03:32', 'http://www.colvenier.be/unieke_belevenis.htm'),
(947, '4', '21.apr2015', '19h00', 'dvogel@tee.toshiba.de', 0, 0, '2015-04-17 15:27:04', 'http://www.colvenier.be/index.php'),
(946, '4', '21.Apr.2015', '19h30', 'dvogel@tee.toshiba.de', 0, 0, '2015-04-17 14:56:01', 'http://www.colvenier.be/index.php'),
(945, '12', '6/6/2015', '1900', 'claude.heidi@telenet.be', 0, 0, '2015-04-16 18:47:34', 'http://www.colvenier.be/'),
(944, '5', '18/4/2015', '19u30', 'marina.beesemans@groupm.com', 0, 0, '2015-04-15 23:12:24', 'http://www.colvenier.be/video.htm'),
(943, '7', '25 april 2015', '18u00', 'karen.swaelen-vanaelst@skynet.be', 0, 0, '2015-04-15 11:46:44', 'http://www.colvenier.be/'),
(942, '2', '15-4-2015', '18.30 uur', 'pierrenelissen@ziggo.nl', 0, 0, '2015-04-14 10:59:50', 'http://www.colvenier.be/'),
(941, '2', '6 mei', '19.00', 'willemlaan1813@gmail.com', 0, 0, '2015-04-13 20:23:56', 'http://www.colvenier.be/unieke_belevenis.htm'),
(940, '2', '21/04/2015', '12', 'joeri@joeriroose.info', 0, 0, '2015-04-11 11:33:48', 'http://www.colvenier.be/'),
(939, '4', '11-04-2015', '19.45', 'ria.degreeff@dk.com', 0, 0, '2015-04-10 11:53:58', 'http://www.colvenier.be/'),
(938, '0', '10121985', 'JbmYRyvrKrpPbbR', 'gabahey25q@gmail.com', 0, 0, '2015-04-09 04:37:07', 'http://www.colvenier.be/'),
(937, '2', '14042015', '12', 'benedicte.verbeeck@telenet.be', 0, 0, '2015-04-08 09:36:14', 'http://www.colvenier.be/'),
(936, '2', '04/04/15', '19u', 'greet.aerts@wol.be', 0, 0, '2015-04-03 17:24:21', 'http://www.colvenier.be/index.php'),
(935, '0', '10121985', 'GbOPPjgbjbcqblDvFQ', 'derby451@hotmail.com', 0, 0, '2015-04-03 14:28:45', 'http://www.colvenier.be/'),
(934, '2', '7 April 2015', '19u30', 'Leo.Klerks@telenet.be', 0, 0, '2015-04-02 22:32:19', 'http://www.colvenier.be/'),
(933, '10', '15.04.2015', '19.00', 'j.cansse@telenet.be', 0, 0, '2015-04-02 09:34:53', 'http://www.colvenier.be/unieke_belevenis.htm'),
(932, '5', 'Woensdag 22 april', '18u', 'pvd5@skynet.be', 0, 0, '2015-04-02 08:52:27', 'http://www.colvenier.be/'),
(931, '0', '', '', 'jleffler62858@floopa.com', 0, 0, '2015-04-02 07:10:02', ''),
(930, '4', 'woensdag 8april', '13.00', 'louis.vdpaal@skynet.be', 0, 0, '2015-04-01 21:28:49', 'http://www.colvenier.be/getuigenissen.htm'),
(929, '2', '04-04-2015', '14.00', 'missjuud@hotmail.com', 0, 0, '2015-04-01 18:35:02', 'http://www.colvenier.be/unieke_belevenis.htm'),
(928, '2', '13.04.2015', '19h00', 'rbeutels@hotmail.com', 0, 0, '2015-03-31 15:43:42', 'http://www.colvenier.be/unieke_belevenis.htm'),
(927, '2', '4-4-2015', '1700', 'bennie42@hotmail.com', 0, 0, '2015-03-31 03:19:58', 'http://www.colvenier.be/unieke_belevenis.htm'),
(926, '2', '03/04/15', '19u30', 'senna_van_rompay@hotmail.com', 0, 0, '2015-03-30 18:24:07', 'http://www.colvenier.be/unieke_belevenis.htm'),
(925, '2', '13/04/2015', '18.00', 'frank.beutels@telenet.be', 0, 0, '2015-03-29 19:39:28', 'http://www.colvenier.be/'),
(924, '2', '13/04/20145', '18.00', 'frank.beutels@telenet.be', 0, 0, '2015-03-29 19:38:33', 'http://www.colvenier.be/'),
(923, '2', '29/03/2015', '18.00', 'josephdecock@skynet.be', 1, 0, '2015-03-29 14:13:40', 'http://www.colvenier.be/'),
(922, '2', '28 maart', '20.00', 'davincitrading@telenet.be', 0, 0, '2015-03-28 16:45:14', 'http://www.colvenier.be/index.php'),
(921, '2', '28-03-2015', '20', 'danny@bisaerts.be', 0, 0, '2015-03-28 14:21:27', 'http://www.colvenier.be/'),
(920, '4', '14-04-2014', '20.00', 'markok@telfort.nl', 0, 0, '2015-03-27 16:38:53', 'http://www.colvenier.be/'),
(919, '2', '27/03', '20h', 'gaelle.fischer@gmail.com', 0, 0, '2015-03-27 16:38:07', 'http://www.colvenier.be/'),
(918, '2', '27 maart', '19:00', 'kgdehaan@outlook.com', 0, 0, '2015-03-27 08:49:04', 'http://www.colvenier.be/'),
(917, '2', '14 april', '19.00', 'lisoi.lisoi@yahoo.com', 0, 0, '2015-03-26 16:36:44', 'http://www.colvenier.be/'),
(916, '4', 'DINSDAG 14 APRIL', '19.30', 'PACOMA@OFFERGELT.NL', 0, 0, '2015-03-26 12:05:15', 'http://www.colvenier.be/'),
(915, '14', '9 mei', '18.30', 'wim.van.broekhoven@telenet.be', 0, 0, '2015-03-25 20:41:52', 'http://www.colvenier.be/'),
(914, '9', '12 september', '19u', 'ak.garnier@noos.fr', 0, 0, '2015-03-24 21:51:30', 'http://www.colvenier.be/index.php'),
(913, '3', '26/03/2015', '18u30', 'desmet.dd@samson-sanv.be', 1, 0, '2015-03-24 16:32:16', 'http://www.colvenier.be/unieke_belevenis.htm'),
(912, '40', '11 of 12 juni 2015', '20.00', 'mpoucki@ezorg.nl', 0, 0, '2015-03-23 15:11:25', 'http://www.colvenier.be/'),
(911, '2', '28 maart', '12.30', 'gerard.put@telenet.be', 0, 0, '2015-03-23 10:47:57', 'http://www.colvenier.be/'),
(910, '4', '30/03/2015', '20', 'manu@durex-casing.com', 0, 0, '2015-03-23 10:20:21', 'http://www.colvenier.be/'),
(909, '2', '27.03.2015', '19.30', 'paulvannieuwenhuyse@telenet.be', 0, 0, '2015-03-22 21:30:21', 'http://www.colvenier.be/'),
(908, '4', '23-05', '19:00', 'ylpang@zonnet.nl', 0, 0, '2015-03-22 19:41:45', 'http://www.colvenier.be/'),
(907, '0', 'uroryere', 'uuyriorr', 'johnd745@gmail.com', 0, 0, '2015-03-22 11:14:43', 'http://www.colvenier.be/'),
(906, '0', 'uroryere', 'uuyriorr', 'johne319@gmail.com', 0, 0, '2015-03-22 11:14:38', 'http://www.colvenier.be/'),
(905, '4', '27 maart 2015', '17u00', 'koenwilmsen@scarlet.be', 0, 0, '2015-03-21 16:08:20', 'http://www.colvenier.be/unieke_belevenis.htm'),
(904, '2', '4/4/15', '20u30', 'gdecoene@skynet.be', 0, 0, '2015-03-21 16:00:06', 'http://www.colvenier.be/unieke_belevenis.htm'),
(902, '12', '15042014', '19:00', 'jennifer.yang@nl.abnamro.com', 0, 0, '2015-03-19 11:42:08', 'http://www.colvenier.be/'),
(901, '0', 'zaterdag 18 april', 'Peersman', '13 personen', 0, 0, '2015-03-19 10:51:29', 'http://www.colvenier.be/unieke_belevenis.htm'),
(900, '3', '19.03.2015', '19.30', 'FHU@METROHM.BE', 0, 0, '2015-03-18 21:14:14', 'http://www.colvenier.be/'),
(899, '1', 'zaterdag 21/03/2015', '13u30', 'bg.wood@bernardgeeraerts.net', 0, 0, '2015-03-18 20:17:03', 'http://www.colvenier.be/'),
(898, '2', '20 MAART ', '19u', 'georgette.brabants@gail.com', 0, 0, '2015-03-18 20:09:22', 'http://www.colvenier.be/index.php'),
(897, '2', '21:03:2015', '19.00', 'jorisvanparys@telenet.be', 0, 0, '2015-03-17 20:57:10', 'http://www.colvenier.be/unieke_belevenis.htm'),
(896, '3', '17 maart 2015', '19u', 'leo.desmet@telenet.be', 1, 0, '2015-03-17 14:11:10', 'http://www.colvenier.be/'),
(895, '3', '25032015', '12:00', 'luc.maerten@pferd.be', 0, 0, '2015-03-17 13:57:32', 'http://www.colvenier.be/'),
(894, '4', '21 maart', '19h00', 'jpvdn@telenet.be', 0, 0, '2015-03-17 12:07:19', 'http://www.colvenier.be/'),
(893, '4', '4 april', '18u30', 'apo.proost.ingrid@gmail.com', 0, 0, '2015-03-17 10:22:34', 'http://www.colvenier.be/'),
(892, '8', '4 april 2015', '19.00', 'sophiemouthaan@gmail.com', 0, 0, '2015-03-16 18:05:05', 'http://www.colvenier.be/'),
(903, '2', '4/4/15', '20u', 'gdecoene@skynet.be', 0, 0, '2015-03-21 15:59:46', 'http://www.colvenier.be/unieke_belevenis.htm'),
(891, '2', '24/4/2015', '19', 'vahona@hotmail.com', 0, 0, '2015-03-16 17:52:58', 'http://www.colvenier.be/'),
(890, '10', '27/03/2015', '17.30', 'vic_kok@yahoo.com', 0, 0, '2015-03-16 13:28:29', 'http://www.colvenier.be/index.php'),
(889, '2', '15 maart', '16.00', 'vanhouten.ron@gmail.com', 0, 0, '2015-03-15 11:28:18', 'http://www.colvenier.be/getuigenissen.htm'),
(888, '2', '24 april 2015', '19 u', 'martinheyligen@hotmail.com', 1, 0, '2015-03-13 22:49:29', 'http://www.colvenier.be/unieke_belevenis.htm'),
(887, '2', '17/3/2015', '20.00', 'jamina_e@hotmail.com', 0, 0, '2015-03-13 13:36:32', 'http://www.colvenier.be/'),
(886, '6', '13/06/2015', '19u00', 'walter.tersago1@telenet.be', 1, 0, '2015-03-13 11:50:01', 'http://www.colvenier.be/'),
(885, '2', '15 maart', '19u', 'michel.tanret@ugent.be', 0, 0, '2015-03-12 20:20:01', 'http://www.colvenier.be/unieke_belevenis.htm'),
(884, '2', '13 March 2015', '20:00', 'mschmid4@its.jnj.com', 0, 0, '2015-03-12 20:13:19', 'http://www.colvenier.be/'),
(883, '6', '31 maart', '18', 'arnoldmoortgat@hotmail.com', 0, 0, '2015-03-12 17:24:39', 'http://www.colvenier.be/index.php'),
(882, '7', '10-04-2015', '19:00 uur', 'michel@merkus.nu', 0, 0, '2015-03-12 16:28:26', 'http://www.colvenier.be/'),
(880, '52000', 'djkkjdqhjl', 'kdqfkjqlkdfm', 'jklkmjklmjkml@kjhdjkhqf.com', 0, 0, '2015-03-12 10:22:05', 'http://www.colvenier.be/'),
(881, '2', '14.03.2015', '19.30', 'erik.greeve@gvgadvocaten.be', 0, 0, '2015-03-12 12:12:20', 'http://www.colvenier.be/'),
(879, '12', '12/02', 'half zeven', 'jef@peeters.be', 0, 0, '2015-03-12 10:09:30', 'http://www.colvenier.be/'),
(878, '8', '5 maart', '17u', 'ttkjht@ccc.com', 0, 0, '2015-03-12 09:48:02', 'http://www.colvenier.be/'),
(877, '6', '18-04-2015', '19.00 uur', 'Eva.Jansen@live.com', 0, 0, '2015-03-11 09:16:50', 'http://www.colvenier.be/index.php'),
(876, '10', '17-08-15', '18:30', 'pim.hagedis@hotmail.com', 0, 0, '2015-03-09 15:18:06', 'http://www.colvenier.be/'),
(875, '3', '16032015', '12:30', 'luc.maerten@pferd.be', 0, 0, '2015-03-09 10:32:28', 'http://www.colvenier.be/unieke_belevenis.htm'),
(874, '7', '02.05.2015', '19.00', 'marco.grassi@telenet.be', 0, 0, '2015-03-08 17:59:10', 'http://www.colvenier.be/getuigenissen.htm'),
(873, '2', '12-3-2015', '19:00', 'ylpang@zonnet.nl', 0, 0, '2015-03-08 12:55:15', 'http://www.colvenier.be/'),
(872, '2', '12-03', '2', 'ylpang@zonnet.nl', 0, 0, '2015-03-08 12:54:37', 'http://www.colvenier.be/'),
(871, '2', '21.03.2015', '19.30', 'pjotr_ivanich2000@yahoo.com', 0, 0, '2015-03-07 16:44:06', 'http://www.colvenier.be/'),
(870, '2', '21/04/2015', 'ja', 'fransvannuland@hotmail.com', 1, 0, '2015-03-07 10:01:49', 'http://www.colvenier.be/'),
(869, '2', '18/03/2015', '13:30', 'bruno.gebruers@gbml.be', 0, 0, '2015-03-06 17:46:12', 'http://www.colvenier.be/'),
(868, '19', '07/03/2015', 'paulpraet@skynet.be', '2', 0, 0, '2015-03-06 16:05:12', 'http://www.colvenier.be/menu.htm'),
(867, '8', '10-04-2015', '19:30', 'michel@merkus.nu', 0, 0, '2015-03-05 19:39:37', 'http://www.colvenier.be/unieke_belevenis.htm'),
(865, '8', '05.03.15', '19.30', 'xavier.engelen@asv.be', 0, 0, '2015-03-04 14:00:04', 'http://www.colvenier.be/'),
(866, '6', '7 maart', 'half zes', 'marjan.minne@telenet.be', 0, 0, '2015-03-05 19:26:46', 'http://www.colvenier.be/'),
(864, '4', '7 maart 2015', '20.30 uur', 'nikki_van_den_berghe@hotmail.com', 0, 0, '2015-03-04 13:38:44', 'http://www.colvenier.be/'),
(863, '19', '27/03/2015', 'nicky.velders@telenet.be', '2', 0, 0, '2015-03-03 21:21:08', 'http://www.colvenier.be/menu.htm'),
(862, '12', '4 april 2015', 'annie.ferket@skynet.BE', '2', 0, 0, '2015-03-03 18:17:52', 'http://www.colvenier.be/menu.htm?utm_source=colvenier&utm_medium=email&utm_campaign=0115'),
(861, '2', 'vrijdag 28 mei', '19,00', 'harmar654agc@gmail.com', 1, 0, '2015-03-03 12:35:59', 'http://www.colvenier.be/'),
(860, '2', '24/04/2015', '19', 'vahona@hotmail.com', 0, 0, '2015-03-02 23:43:25', 'http://www.colvenier.be/'),
(859, '6', '9/3/2015', '19h', 'nathalie.simons@agfa.com', 0, 0, '2015-03-02 15:50:13', 'http://www.colvenier.be/'),
(857, '2', '7/3/2015', '19u30', 'wim.demeestere@ds-n.com', 0, 0, '2015-03-01 22:56:22', 'http://www.colvenier.be/'),
(858, '40', '24-04-2015', '+/- 19.00 uur', 'm.vanekeren@zevij-necomij.com', 0, 0, '2015-03-02 15:39:52', 'http://www.colvenier.be/'),
(856, '15', '6/3/2015', '19 uur', 'louisgay1@live.com', 0, 0, '2015-03-01 22:53:25', 'http://www.colvenier.be/'),
(855, '18', '14 maart 2015', 'mpunie@telenet.be', '2', 0, 0, '2015-03-01 21:40:53', 'http://www.colvenier.be/menu.htm?utm_source=colvenier&utm_medium=email&utm_campaign=0115'),
(854, '12', '12032015', 'rvhgi1@hotmail.com', '4', 0, 0, '2015-03-01 16:07:02', 'http://www.colvenier.be/menu.htm'),
(853, '1930', '7/3/2015', 'sgoethaert@skynet.be', '2', 0, 0, '2015-03-01 11:26:23', 'http://www.colvenier.be/menu.htm?utm_source=colvenier&utm_medium=email&utm_campaign=0115'),
(852, '2', '28 februari', '20.00', 'yves@arzo.be', 0, 0, '2015-02-28 16:01:14', 'http://www.colvenier.be/'),
(851, '2', '28/02/2015', '7.30', 'vdbleeken@scarlet.be', 0, 0, '2015-02-28 14:06:21', 'http://www.colvenier.be/'),
(850, '19', '28 februari 2015', 'bart.cassiers@telenet.be', '2', 0, 0, '2015-02-28 10:04:21', 'http://www.colvenier.be/menu.htm'),
(849, '4', '28/02/2015', '19.30u', 'bruno_demulder@hotmail.com', 0, 0, '2015-02-27 21:58:27', 'http://www.colvenier.be/'),
(848, '18', '14 maart 2015', 'mpunie@telenet.be', '2', 0, 0, '2015-02-27 20:48:10', 'http://www.colvenier.be/menu.htm?utm_source=colvenier&utm_medium=email&utm_campaign=0115'),
(847, '13', '14 maart 2015', 'mpunie@telenet.be', '2', 0, 0, '2015-02-27 20:13:53', 'http://www.colvenier.be/menu.htm?utm_source=colvenier&utm_medium=email&utm_campaign=0115'),
(846, '13', '14 maart 2015', 'mpunie@telenet.be', '2', 0, 0, '2015-02-27 19:55:51', 'http://www.colvenier.be/menu.htm?utm_source=colvenier&utm_medium=email&utm_campaign=0115'),
(845, '13', '14 maart 2015', 'mpunie@telenet.be', '2', 0, 0, '2015-02-27 19:54:18', 'http://www.colvenier.be/menu.htm?utm_source=colvenier&utm_medium=email&utm_campaign=0115'),
(844, '15', '27/2/15', '19 u', 'louisgay1@live.com', 0, 0, '2015-02-26 23:03:52', 'http://www.colvenier.be/'),
(843, '11', '1 maart', '13.00', 'Lut.VanLaer@uantwerpen.be', 0, 0, '2015-02-26 21:51:31', 'http://www.colvenier.be/unieke_belevenis.htm'),
(842, '4', '03/03/2015', '18 uur', 'test@test.be', 0, 0, '2015-02-26 12:06:29', 'http://www.colvenier.be/index.php'),
(841, '19', '7 maart', 'rudy.matterne1@telenet.be', '4', 0, 0, '2015-02-25 22:38:11', 'http://www.colvenier.be/menu.htm?utm_source=colvenier&utm_medium=email&utm_campaign=0115'),
(840, '2', '28/02/2015', '20 UUR', 'huylebroecksofie@gmail.com', 0, 0, '2015-02-25 22:15:54', 'http://www.colvenier.be/'),
(839, '4', '28 maart ', '12 uur', 'lief.nauwelaarts@telenet.be', 0, 0, '2015-02-25 17:28:25', 'http://www.colvenier.be/unieke_belevenis.htm'),
(838, '2', '06/04/2015', '13 ', 'marcelcollier@telenet.be', 0, 0, '2015-02-25 17:02:12', 'http://www.colvenier.be/index.php'),
(837, '19', '20.06/2015', 'sb279413@skynet.be', '2', 0, 0, '2015-02-25 15:51:36', 'http://www.colvenier.be/menu.htm?utm_source=colvenier&utm_medium=email&utm_campaign=0115'),
(836, '19', '3 maart 2015', 'sofielemlijn@msn.com', '2', 0, 0, '2015-02-25 09:34:54', 'http://www.colvenier.be/menu.htm?utm_source=colvenier&utm_medium=email&utm_campaign=0115'),
(835, '2', '25/02/2015', '19.00', 'patrick.haverhals@telenet.be', 0, 0, '2015-02-24 23:13:08', 'http://www.colvenier.be/'),
(834, '17', '27-maart-2015', '19.00', 'manfred.corijn@akzonobel.com', 0, 0, '2015-02-23 17:18:56', 'http://www.colvenier.be/'),
(833, '16', '27-maart-2015', '19.00', 'manfred.corijn@akzonobel.com', 0, 0, '2015-02-23 17:18:29', 'http://www.colvenier.be/'),
(832, '6', '7 maart', '13 uur', 'suzanne.nove@telenet.be', 0, 0, '2015-02-23 17:16:06', 'http://www.colvenier.be/'),
(831, '6', '7 maart', '19 uur', 'suzanne.nove@telenet.be', 0, 0, '2015-02-23 17:14:32', 'http://www.colvenier.be/'),
(1099, '2', '05-01-2015', '18.00', 'dekever81@gmail.com', 1, 0, '2015-06-03 09:08:16', 'http://www.colvenier.be/'),
(1098, '0', '13 aug ', '14 uu', 'fzefz@dddd.com', 0, 0, '2015-06-03 06:23:13', 'http://www.colvenier.be/'),
(1097, '2', '13 aug', '13 uur', 'brainpop.eu@gmail.com', 1, 0, '2015-06-03 06:16:34', 'http://www.colvenier.be/'),
(1096, '0', '03/06/2015', 'uur etentje ?', 'INFO@COLVENIER.BE', 1, 0, '2015-06-02 20:42:38', 'http://www.colvenier.be/'),
(1095, '0', '02/06/2015', 'uur etentje ?', 'INFO@COLVENIER.BE', 1, 0, '2015-06-02 20:42:20', 'http://www.colvenier.be/'),
(1094, '0', '02/06/2015', 'uur etentje ?', 'INFO@COLVENIER.BE', 1, 0, '2015-06-02 20:42:04', 'http://www.colvenier.be/'),
(1093, '2', '6 juni 2015', '19.30', 'diane.teunen@hotmail.com', 0, 0, '2015-06-02 19:15:10', 'http://www.colvenier.be/'),
(1092, '4', '18.06.2015', '19.30 uur', 'cecile.adriaens@thyssenkrupp.com', 1, 0, '2015-06-02 16:19:30', 'http://www.colvenier.be/'),
(1091, '13', '3 juni 2015', 'paul.heysse@pandora.be', '2', 0, 0, '2015-06-02 14:08:37', 'http://www.colvenier.be/menu.htm'),
(1090, '13', '3 juni 2015', 'paul.heysse@pandora.be', '2', 0, 0, '2015-06-02 14:08:10', 'http://www.colvenier.be/menu.htm'),
(1055, '2', '05/06/2015', '20u', 'marc.brokken@skynet.be', 1, 0, '2015-05-25 15:49:48', 'http://www.colvenier.be/'),
(1056, '20', '19/06/2015', 'kvb5000@gmail.com', '5', 0, 0, '2015-05-25 22:55:37', 'http://www.colvenier.be/menu.htm'),
(1057, '8', '27/05/2015', '19.00 hr', 'roger@malu.eu', 1, 0, '2015-05-26 10:38:32', 'http://www.colvenier.be/'),
(1058, '3', '26-06-2015', '12', 'evy.kerstens@cm.be', 0, 0, '2015-05-26 11:17:44', 'http://www.colvenier.be/unieke_belevenis.htm'),
(1059, '10', '25 aug 2015', '13:00', 'janpadam@gmail.com', 0, 0, '2015-05-26 14:15:51', 'http://www.colvenier.be/'),
(1060, '19', '13/06/2015', 'louis.meuwis@skynet.be', '3', 0, 0, '2015-05-26 19:28:57', 'http://www.colvenier.be/menu.htm'),
(1061, '19', '13/06/2015', 'louis.meuwis@skynet.be', '3', 0, 0, '2015-05-26 19:30:04', 'http://www.colvenier.be/menu.htm'),
(1062, '19', '13/06/2015', 'louis.meuwis@skynet.be', '3', 0, 0, '2015-05-26 19:31:04', 'http://www.colvenier.be/menu.htm'),
(1063, '3', '28/05/2015', '12u', 'katleen@idmix.be', 0, 0, '2015-05-26 21:43:43', 'http://www.colvenier.be/'),
(1064, '2', '27/5/2015', '19h', 'tonny_van_der_heyden@hotmail.com', 1, 0, '2015-05-26 22:35:54', 'http://www.colvenier.be/index.php'),
(1065, '4', '20/06/2015', '13.00', 'dokterhj@skynet.be', 1, 0, '2015-05-27 22:09:40', 'http://www.colvenier.be/'),
(1066, '2', '30-5-2015', '19:00', 'jonathan-griffioen@hotmail.com', 0, 0, '2015-05-28 16:33:46', 'http://www.colvenier.be/unieke_belevenis.htm'),
(1067, '2', '29-may-2015', 'diner', 'adok@kpnplanet.nl', 1, 0, '2015-05-29 02:07:47', 'http://www.colvenier.be/'),
(1068, '4', '19/06/2015', '12u30', 'koen@atf.be', 1, 0, '2015-05-29 13:05:53', 'http://www.colvenier.be/'),
(1069, '18', '13/07/2015', 'danny.torfs@skynet.be', '4', 0, 0, '2015-05-29 13:06:18', 'http://www.colvenier.be/menu.htm'),
(1070, '16', 'woensdag 3 juni 2015', '19u', 'lotte@vredescentrum.be', 1, 0, '2015-05-29 15:12:06', 'http://www.colvenier.be/'),
(1071, '4', '30/05/2015', '1900', 'guido.schelfhout@telenet.be', 1, 0, '2015-05-29 19:44:59', 'http://www.colvenier.be/'),
(1072, '18', '31/05/2015', 'formen08@modeno.be', '2', 0, 0, '2015-05-29 21:36:03', 'http://www.colvenier.be/menu.htm'),
(1073, '2', '30 mei ', '13 uuu', 'sb015339@skynet.be', 0, 0, '2015-05-30 11:29:11', 'http://www.colvenier.be/unieke_belevenis.htm'),
(1074, '2', '13 juni 2015', '19 u 00', 'etva@telenet.be', 1, 0, '2015-05-30 12:18:53', 'http://www.colvenier.be/'),
(1075, '19', '10/06/2015', 'jefmatt@hotmail.com', '2', 0, 0, '2015-05-31 15:05:38', 'http://www.colvenier.be/menu.htm'),
(1076, '18', '30/06/2015', 'jefmatt@hotmail.com', '2', 0, 0, '2015-05-31 15:19:41', 'http://www.colvenier.be/menu.htm'),
(1077, '18', '30/06/2015', 'jefmatt@hotmail.com', '2', 0, 0, '2015-05-31 15:21:12', 'http://www.colvenier.be/menu.htm'),
(1078, '4', 'Woensdag 29 Juli', '13u', 'veerle.vinken@skynet.be', 1, 0, '2015-05-31 18:15:59', 'http://www.colvenier.be/'),
(1079, '4', '18-6-2015', '19.30', 'peter.swinkels@thyssenkrupp.com', 0, 0, '2015-05-31 19:29:34', 'http://www.colvenier.be/'),
(1080, '4', '18.06.2015', '19.30 uur', 'cecile.adriaens@thyssenkrupp.com', 1, 0, '2015-05-31 22:49:37', 'http://www.colvenier.be/'),
(1081, '4', '06062015', '19 ', 'jrudy.stals@tevean.be', 0, 0, '2015-06-01 05:41:05', 'http://www.colvenier.be/'),
(1082, '2', '3/6/2015', '18:30', 'wimverstraelen@hotmail.com', 0, 0, '2015-06-01 08:07:44', 'http://www.colvenier.be/'),
(1083, '25', '15/06/2015', '18u30', 'diana.dhont@exxonmobil.com', 0, 0, '2015-06-01 10:19:35', 'http://www.colvenier.be/'),
(1084, '4', '10 juni 2015', '12:00 uur', 'dejong@bladel.tokheim.com', 1, 0, '2015-06-01 16:10:01', 'http://www.colvenier.be/'),
(1085, '4', '22 augustus 2015', '19', 'swa.dierckx@skynet.be', 1, 0, '2015-06-01 19:38:13', 'http://www.colvenier.be/unieke_belevenis.htm'),
(1086, '4', '22-08-2015', '19.00h', 'swa.dierckx@skynet.be', 1, 0, '2015-06-01 19:46:28', 'http://www.colvenier.be/'),
(1087, '8', '13 juni 2015', '1900', 'minet@travelxlathome.nl', 0, 0, '2015-06-01 21:23:40', 'http://www.colvenier.be/getuigenissen.htm'),
(1088, '12', '1 juli', 'marianne.croisiaux@gmail.com', '6', 0, 0, '2015-06-02 12:04:57', 'http://www.colvenier.be/menu.htm'),
(1089, '12', '24 06 15', 'jvancutsem4@gmail.com', '2', 0, 0, '2015-06-02 13:17:38', 'http://www.colvenier.be/menu.htm'),
(1100, 'zeven', '23 uag', '12 uur', 'ergeg@fff.com', 0, 0, '2015-06-03 11:54:20', 'http://www.colvenier.be/'),
(1101, '3', '26/6', '12.30', 'caroline.steegmans@cm.be', 1, 0, '2015-06-04 17:00:29', 'http://www.colvenier.be/'),
(1102, '2', '06062015', '19h', 'somers.ivan@skynet.be', 0, 0, '2015-06-06 12:22:46', 'http://www.colvenier.be/'),
(1103, '2', '10/7', '12.30', 'kowi323@hotmail.com', 1, 0, '2015-06-08 16:41:33', 'http://www.colvenier.be/'),
(1104, '18 uur', '09.06.2015', 'ivo.penders@telenet.be', '2', 0, 0, '2015-06-08 20:25:52', 'http://www.colvenier.be/menu.htm'),
(1105, '6 of 8 , met RES betalen aub', '27 juni 2015', '12.30', 'info@vs-adres.be', 1, 0, '2015-06-09 15:56:59', 'http://www.colvenier.be/'),
(1106, '19u00', '17 juli 2015', 'annymutton@gmail.com', '2', 0, 0, '2015-06-09 21:53:26', 'http://www.colvenier.be/menu.htm'),
(1107, '2', '12-06-2015', '20:00', 'joaquin.bruynseels@gmail.com', 1, 0, '2015-06-10 11:57:34', 'http://www.colvenier.be/'),
(1108, '4', '21/06/2015', '19:30', 'edv@raposa.be', 1, 0, '2015-06-11 12:12:47', 'http://www.colvenier.be/'),
(1109, '4', '21/06/2015', '19:30', 'edv@raposa.be', 1, 0, '2015-06-11 12:22:19', 'http://www.colvenier.be/'),
(1110, '2', '13/06/2015', '19.30', 'e.bolluijt@telenet.be', 1, 0, '2015-06-11 19:32:00', 'http://www.colvenier.be/'),
(1111, '2', '13/06/2015', '19.30', 'e.bolluijt@telenet.be', 1, 0, '2015-06-12 07:39:37', 'http://www.colvenier.be/'),
(1112, '2', '20/06/2015', '19.30', 'rp59@telenet.be', 0, 0, '2015-06-12 09:07:20', 'http://www.colvenier.be/'),
(1113, '4', '1 augustus 2015', '19u30', 'egilissen@be.imshealth.com', 1, 0, '2015-06-13 10:39:59', 'http://www.colvenier.be/'),
(1114, '6', '11 juli', '19.00', 'g.j.drent@hetnet.nl', 1, 0, '2015-06-14 18:14:55', 'http://www.colvenier.be/'),
(1115, '19.00', '20/06/2015', 'Eva.gort@vdab.be', '2', 0, 0, '2015-06-14 20:53:57', 'http://www.colvenier.be/menu.htm'),
(1116, '6', '26/06/2015', '18.00 uur', 'katrien.caers@philips.com', 1, 0, '2015-06-15 09:41:02', 'http://www.colvenier.be/'),
(1117, '2', '20/07/2015', '19.00', 'Eva.gort@vdab.be', 1, 0, '2015-06-16 11:34:36', 'http://www.colvenier.be/'),
(1118, '19:00', '23/06/2015', 'annekeleen@hotmail.com', '3', 0, 0, '2015-06-16 14:09:42', 'http://www.colvenier.be/menu.htm'),
(1119, '2', '19/06/2015', '17.00', 'koen.woestenborghs@thyssenkrupp.com', 0, 0, '2015-06-16 17:04:00', 'http://www.colvenier.be/unieke_belevenis.htm'),
(1120, '1', '1', '1', '1', 0, 0, '2015-06-17 05:54:04', ''),
(1121, '1', '1', '1', '1', 0, 0, '2015-06-17 05:54:05', ''),
(1122, '1', '1', '1', '1', 0, 0, '2015-06-17 05:54:05', ''),
(1123, '2 personen', '20 juni 2015', '19.00 u', 'chris.dhaenens@telenet.be', 0, 0, '2015-06-17 10:38:35', 'http://www.colvenier.be/'),
(1124, '2 personen', '21 juni 2015', '19.00 u', 'chris.dhaenens@telenet.be', 0, 0, '2015-06-17 10:48:27', 'http://www.colvenier.be/'),
(1125, '7', '04/07/2015', '12.00', 'gstarbe@hotmail.com', 1, 0, '2015-06-17 15:37:18', 'http://www.colvenier.be/'),
(1126, '15', '25/06/2015', '20.00', 'paul.van.schil@uza.be', 1, 0, '2015-06-18 08:46:40', 'http://www.colvenier.be/'),
(1127, '18.30', '18/06/15', 'kristine.verachtert@vat-house.com', '4', 0, 0, '2015-06-18 12:06:15', 'http://www.colvenier.be/menu.htm'),
(1128, '2', '19-06-2015', '14.00', 'info@cajera.nl', 1, 0, '2015-06-18 13:34:52', 'http://www.colvenier.be/unieke_belevenis.htm'),
(1129, '4', '21/6/2015', '19.00', 'stubbe99@msn.com', 1, 0, '2015-06-18 23:26:09', 'http://www.colvenier.be/unieke_belevenis.htm'),
(1130, '2', '19-06-2015', '18.00', 'wencdobbelaer@online.nl', 1, 0, '2015-06-19 11:54:46', 'http://www.colvenier.be/unieke_belevenis.htm'),
(1131, '40', '19 augustus 2015', '19:00', 'olivier.voet@uantwerpen.be', 0, 0, '2015-06-19 16:21:02', 'http://www.colvenier.be/'),
(1132, '0466372322', 'Samim', 'Work', 'Niirahmed@gmail.com', 0, 0, '2015-06-20 11:11:05', 'http://www.colvenier.be/'),
(1133, '2', '23-08-2015', '20:00', 'eddy_van_meir@hotmail.com', 1, 0, '2015-06-23 13:57:49', 'http://www.colvenier.be/'),
(1134, '6', '30 juni 2015', '19:30 h', 'brigitte.lejon@alcatel-lucent.com', 1, 0, '2015-06-23 14:24:07', 'http://www.colvenier.be/'),
(1135, '4', '26/06/2015', '20.00', 'vermeerbergen@telenet.be', 0, 0, '2015-06-23 15:32:25', 'http://www.colvenier.be/unieke_belevenis.htm'),
(1136, '2', 'vrijdag 26 juni', '20.00 ur', 'corineveldhuizen@live.nl', 1, 0, '2015-06-23 15:32:50', 'http://www.colvenier.be/'),
(1137, '8', '16/07/2015', '21.00', 'hans.helsen@brutex.com', 0, 0, '2015-06-24 10:38:31', 'http://www.colvenier.be/'),
(1138, '2', '29 06 15', '13 00', 'ddillen@skynet.be', 1, 0, '2015-06-25 05:45:40', 'http://www.colvenier.be/'),
(1139, '2', '27-06-2015', '18:30', 'swpfaasen@gmail.com', 0, 0, '2015-06-25 08:41:02', 'http://www.colvenier.be/'),
(1140, '2', '27 juni', '17:00 u', 'alfons.dekens@gmail.com', 1, 0, '2015-06-26 10:50:41', 'http://www.colvenier.be/unieke_belevenis.htm'),
(1141, '2', '27/6', '19:00 u', 'alfons.dekens@gmail.com', 1, 0, '2015-06-26 10:51:27', 'http://www.colvenier.be/unieke_belevenis.htm'),
(1142, '2', '27/06/2015', '14', 'patrickcheack@hotmail.com', 0, 0, '2015-06-26 21:46:45', 'http://www.colvenier.be/'),
(1143, '4', '3 juli 2015', '12.30', 'jacques@spaas.com', 1, 0, '2015-06-28 23:00:36', 'http://www.colvenier.be/'),
(1144, '2', '29 juni', '19:30', 'yannickabrath@hotmail.com', 1, 0, '2015-06-29 11:44:26', 'http://www.colvenier.be/'),
(1145, '2', '30 juni', '19:00', 'k.nijdam@live.nl', 1, 0, '2015-06-29 20:18:41', 'http://www.colvenier.be/'),
(1146, '19:00', '30 juni', 'k.nijdam@live.nl', '2', 0, 0, '2015-06-30 00:03:40', 'http://www.colvenier.be/menu.htm'),
(1147, '3', '01/07/2015', '13u', 'marianne.croisiaux@gmail.com', 0, 0, '2015-06-30 08:00:30', 'http://www.colvenier.be/'),
(1148, '40', '29 augustus 2015', '*/- 12.00 h', 'willy.walscharts@telenet.be', 0, 0, '2015-06-30 09:05:43', 'http://www.colvenier.be/'),
(1149, '50 tot 60', '18 september 2015', '20.00 uur', 'j.heutinck@netterden.com', 0, 0, '2015-06-30 09:50:27', 'http://www.colvenier.be/'),
(1150, '3', '07/07/15', '20h00', 'kris.welens@basf.com', 0, 0, '2015-07-02 21:00:30', 'http://www.colvenier.be/'),
(1151, '6', '07.08.2015', '18.00', 'niquemaes@gmail.com', 1, 0, '2015-07-02 21:05:49', 'http://www.colvenier.be/'),
(1152, '6', '25.07.2015', '18.00', 'niquemaes@gmail.com', 1, 0, '2015-07-02 22:28:40', 'http://www.colvenier.be/'),
(1153, '3', '11/07/2015', '19.00u', 'mariane.panis@telenet.be', 1, 0, '2015-07-03 18:15:20', 'http://www.colvenier.be/index.php'),
(1154, '2', '07/07/2015', '12.30', 'sabine.labis@be.issworld.com', 1, 0, '2015-07-03 21:31:53', 'http://www.colvenier.be/index.php'),
(1155, '2', '07/07/2015', '12.30', 'Sabine.labis@be.issworld.com', 1, 0, '2015-07-03 21:50:34', 'http://www.colvenier.be/index.php'),
(1156, '14', '12/09/2015', '12u30', 'hilde.buyck@telenet.be', 0, 0, '2015-07-04 22:28:45', 'http://www.colvenier.be/index.php'),
(1157, '2', '06/07/2015', '19 u', 'paulcool1@telenet.be', 0, 0, '2015-07-05 11:04:52', 'http://www.colvenier.be/unieke_belevenis.htm'),
(1158, '2', '1 augustus 2015', '19u30', 'c_annelies@hotmail.com', 0, 0, '2015-07-05 13:40:40', 'http://www.colvenier.be/unieke_belevenis.htm'),
(1159, '5', '15.08.2015', '18.30', 'giesel@skynet.be', 1, 0, '2015-07-05 14:45:19', 'http://www.colvenier.be/'),
(1160, '2', '06/07/2015', '19 u', 'paulcools1@telenet.be', 1, 0, '2015-07-05 17:28:35', 'http://www.colvenier.be/'),
(1161, '4', '18 juli', '19u30', 'johanenelsvandewalle@telenet.be', 1, 0, '2015-07-06 11:28:38', 'http://www.colvenier.be/index.php'),
(1162, '20 - 25', '09.10.2015', '19.30', 'tillyfriedrichs@hotmail.com', 1, 0, '2015-07-06 13:19:28', 'http://www.colvenier.be/unieke_belevenis.htm'),
(1163, '2', '10/07/2015', '19u30', 'kristof.langsberg@telenet.be', 0, 0, '2015-07-06 15:58:49', 'http://www.colvenier.be/unieke_belevenis.htm'),
(1164, '5', '10/07/2015', '12 u 30', 'eric.kapellen@telenet.be', 1, 0, '2015-07-07 12:55:29', 'http://www.colvenier.be/'),
(1165, '60', '31-10-2015', '19:00 uur', 'rosanne@turnkeyevents.nl', 0, 0, '2015-07-07 21:01:03', 'http://www.colvenier.be/'),
(1166, '6', '7 augustus', '18:00', 'niquemaes@gmail.com', 1, 0, '2015-07-08 10:20:30', 'http://www.colvenier.be/'),
(1167, '6', '24 juli 2015', '18:00', 'niquemaes@gmail.com', 1, 0, '2015-07-08 11:36:15', 'http://www.colvenier.be/'),
(1168, '20.00 uur', '11-07-2015', 'marlene.deroos@telenet.be', '4', 0, 0, '2015-07-08 11:36:16', 'http://www.colvenier.be/menu.htm'),
(1169, '12 u', '19/07/2015', 'vanassche.tacq@skynet.be', '8', 0, 0, '2015-07-08 15:01:15', 'http://www.colvenier.be/menu.htm'),
(1170, '4', '2 augustus 2015', '12.30u.', 'marcel.dalemans@telenet.be', 0, 0, '2015-07-08 21:26:05', 'http://www.colvenier.be/index.php'),
(1171, '4', '25/07/2015', '20.00', 'philip.feront@euroclear.com', 0, 0, '2015-07-09 15:58:33', 'http://www.colvenier.be/getuigenissen.htm'),
(1172, '2', '10/07/2014', '20.00 uur', 'aerts@benilco.be', 1, 0, '2015-07-09 16:46:33', 'http://www.colvenier.be/'),
(1173, '2', '11/07/15', '20.00', 'hugo@bdwbeheer.be', 1, 0, '2015-07-11 12:53:09', 'http://www.colvenier.be/'),
(1174, '2', '25 juli', '19u00', 'hellinx.jan@gmail.com', 1, 0, '2015-07-12 16:04:17', 'http://www.colvenier.be/unieke_belevenis.htm'),
(1175, '6', '21/07/2015', '13', 'saelens.nathalie@telenet.be', 1, 0, '2015-07-12 22:03:15', 'http://www.colvenier.be/'),
(1176, '4', '17/07/2015', '19.15 H ', 'nadinepiessens@piessenselectro.com', 1, 0, '2015-07-13 10:52:13', 'http://www.colvenier.be/'),
(1177, '4', '25 juli 2015', '20u', 'lenaerts.koen@telenet.be', 0, 0, '2015-07-13 12:40:51', 'http://www.colvenier.be/unieke_belevenis.htm'),
(1178, '4', '25/07/2015', '20', 'marleen.faes@eandis.be', 0, 0, '2015-07-13 12:48:36', 'http://www.colvenier.be/'),
(1179, '3', '22/07/2015', '13u', 'leenwuyts1@gmail.com', 0, 0, '2015-07-13 15:43:46', 'http://www.colvenier.be/'),
(1180, '4', '1 augustus 2015', '19.30', 'dirkreyniers@telenet.be', 1, 0, '2015-07-13 16:24:14', 'http://www.colvenier.be/index.php'),
(1181, '2', '13/7/2015', '19.30', 'janssens.stef1@gmail.com', 0, 0, '2015-07-13 16:41:39', 'http://www.colvenier.be/'),
(1182, '2', '14 juli 2015', '1200', 'jozef.de.vil@telenet.be', 1, 0, '2015-07-13 17:53:43', 'http://www.colvenier.be/unieke_belevenis.htm'),
(1183, '2', '23/07/2015', '19:30', 'johan.mignon@wayss-freytag.be', 1, 0, '2015-07-14 13:53:45', 'http://www.colvenier.be/'),
(1184, '2', '18-07-2015', '17:30', 'bruno.rafael.sa@telenet.be', 0, 0, '2015-07-16 11:01:34', 'http://www.colvenier.be/'),
(1185, '2', 'zaterdag 18 juli 2015', '20.00 uur', 'm.w.vanboven@gmail.com', 0, 0, '2015-07-16 14:04:43', 'http://www.colvenier.be/'),
(1186, '6', '8 augustus', '20', 'alg.bouw.coertjens@skynet.be', 1, 0, '2015-07-16 19:15:58', 'http://www.colvenier.be/unieke_belevenis.htm'),
(1187, '2', '17/07/2015', '19U', 'patrick.pauwels@telenet.be', 1, 0, '2015-07-17 15:13:30', 'http://www.colvenier.be/'),
(1188, '2', '25/07/2015', '19:00', 'juliendemeyer@skynet.be', 1, 0, '2015-07-17 16:05:32', 'http://www.colvenier.be/'),
(1189, '2', '17/07/2015', '19U', 'patrick.pauwels@telenet.be', 1, 0, '2015-07-17 16:35:10', 'http://www.colvenier.be/'),
(1190, '20:00', '20/07/2015', 'lieven.goosens@axa.be', '2', 0, 0, '2015-07-17 22:37:51', 'http://www.colvenier.be/menu.htm'),
(1191, '6', '22/08/2015', '19u', 'freddy.claeys42@telenet.be', 1, 0, '2015-07-19 11:42:36', 'http://www.colvenier.be/'),
(1192, '19.30', '19 juli 2015', 'a.verresen@gmail.com', '2', 0, 0, '2015-07-19 14:25:48', 'http://www.colvenier.be/menu.htm'),
(1193, '3', '7 augustus', '20.00', 'Lieveopgenhaffen@telenet.be', 1, 0, '2015-07-19 20:22:29', 'http://www.colvenier.be/'),
(1194, '2', '31-12-2015', '20:00 ', 'hugolantain@hotmail.com', 1, 0, '2015-07-19 21:20:54', 'http://www.colvenier.be/'),
(1195, '2', '21juli', '12.30', 'gerda2000@hotmail.com', 0, 0, '2015-07-20 10:06:57', 'http://www.colvenier.be/'),
(1196, '7', '25/7/2015', '12:30', 'roger.a.somers@gmail.com', 0, 0, '2015-07-20 10:37:45', 'http://www.colvenier.be/index.php'),
(1197, '12.30', '25.07.2015', 'noe.anny@gmail.com', '7', 0, 0, '2015-07-20 11:23:47', 'http://www.colvenier.be/menu.htm'),
(1198, '4', '25/07/2015', '13uur', 'christine.gautier64@hotmail.com', 1, 0, '2015-07-20 17:11:13', 'http://www.colvenier.be/'),
(1199, '4', '25/07', '19u', 'mausekevd@hotmail.com', 0, 0, '2015-07-20 18:31:44', 'http://www.colvenier.be/'),
(1200, '2', '22juli', '13uur', 'simonne.langendries@skynet.be', 1, 0, '2015-07-21 14:28:56', 'http://www.colvenier.be/'),
(1201, '2', '22 juli 2015', '13 uur', 'simonne.langendries@skynet.be', 1, 0, '2015-07-21 18:48:30', 'http://www.colvenier.be/'),
(1202, '2', '22 juli 2015', '13 uur', 'simonne.langendries@skynet.be', 1, 0, '2015-07-21 19:00:46', 'http://www.colvenier.be/'),
(1203, '19:00', '23/07/2015', 'lenders.stephanie@gmail.com', '4', 0, 0, '2015-07-22 11:06:54', 'http://www.colvenier.be/menu.htm'),
(1204, '19:30', '23/07/2015', 'lenders.stephanie@gmail.com', '4', 0, 0, '2015-07-22 11:07:35', 'http://www.colvenier.be/menu.htm'),
(1205, '12.30 : 13.00', '4 augustus 2015', 'jacques.mommensketelers@telenet.be', '8', 0, 0, '2015-07-22 11:31:54', 'http://www.colvenier.be/menu.htm'),
(1206, '5', '1508', '20', 'test@foo.com', 0, 0, '2015-07-22 13:14:43', 'http://www.colvenier.be/unieke_belevenis.htm'),
(1207, '2', '16/08/2015', '19.00', 'willy.van.den.bulck@telenet.be', 1, 0, '2015-07-22 17:39:36', 'http://www.colvenier.be/index.php'),
(1208, '2', '25/07/2015', '20:00', 'roeland.molleken@skynet.be', 0, 0, '2015-07-22 19:58:26', 'http://www.colvenier.be/unieke_belevenis.htm'),
(1209, '2', '31/07/15', '20u00', 'samuel.cornelissen@stad.antwerpen.be', 0, 0, '2015-07-23 12:29:58', 'http://www.colvenier.be/'),
(1210, '2', '23/07', '20', 'erik@ecachim.be', 0, 0, '2015-07-23 13:42:33', 'http://www.colvenier.be/index.php'),
(1211, '5', 'dinsdag 28juli 2015', '19u30', 'guy.verbist@bcdme.com', 1, 0, '2015-07-23 18:55:44', 'http://www.colvenier.be/index.php'),
(1212, '2', '24 7', '20', 'vanriel-dhaen@hotmail.com', 0, 0, '2015-07-24 14:38:50', 'http://www.colvenier.be/getuigenissen.htm'),
(1213, '2', '8/8', '20:00', 'peggy_vos@hotmail.com', 0, 0, '2015-07-24 15:08:23', 'http://www.colvenier.be/unieke_belevenis.htm'),
(1214, '2', '25/07/2015', '19.00', 'pdeceuster@mscbelgium.com', 1, 0, '2015-07-25 09:25:26', 'http://www.colvenier.be/'),
(1215, '1', '26-07-2015', '19:00 uur', 'beensjeroen@gmail.com', 0, 0, '2015-07-25 14:30:54', 'http://www.colvenier.be/unieke_belevenis.htm'),
(1216, '4', '26/07/2015', '13u00', 'guy.janssens@hotmail.be', 0, 0, '2015-07-25 20:35:39', 'http://www.colvenier.be/'),
(1217, '2', '04/08/2015', '18:00', 'michelle.malfait@live.com', 0, 0, '2015-07-26 13:44:51', 'http://www.colvenier.be/'),
(1218, '2', '29-08-2015', '19:00', 'arie.van.loon@startmail.com', 1, 0, '2015-07-27 06:57:36', 'http://www.colvenier.be/'),
(1219, '2', '01/08/15', '19.30', 'brigitteampe@gmail.com', 1, 0, '2015-07-27 12:56:45', 'http://www.colvenier.be/'),
(1220, '2', '27 -7', '20', 'vanriel-dhaen@hotmail.com', 0, 0, '2015-07-27 14:22:21', 'http://www.colvenier.be/'),
(1221, '5', '28 juli 2015', '19u30', 'guy.verbist@bcdme.com', 1, 0, '2015-07-27 14:45:58', 'http://www.colvenier.be/'),
(1222, '4', '30/07/2015', '19', 'evidubois@hotmail.com', 1, 0, '2015-07-27 15:28:26', 'http://www.colvenier.be/index.php'),
(1223, '2', '30/6/2015', '19.30 uur', 'dirk.de.backer@beveren.be', 1, 0, '2015-07-27 16:26:35', 'http://www.colvenier.be/unieke_belevenis.htm'),
(1224, '2', '1 augustus 2015', '20', 'roelssofie100@hotmail.com', 0, 0, '2015-07-27 16:40:05', 'http://www.colvenier.be/index.php'),
(1225, '20.00 uur', '30/7/2015', 'dirk.de.backer@beveren.be', '2', 0, 0, '2015-07-28 14:19:56', 'http://www.colvenier.be/menu.htm'),
(1226, '2', '07082015', '19', 'koencarine@hotmail.com', 1, 0, '2015-07-28 16:55:46', 'http://www.colvenier.be/'),
(1227, '2', '07082015', '19.30', 'koencarine@hotmail.com', 1, 0, '2015-07-28 17:23:58', 'http://www.colvenier.be/'),
(1228, '13.30 ', '29/07/15', 'stefan.delplace@skynet.be', '2', 0, 0, '2015-07-29 09:25:49', 'http://www.colvenier.be/menu.htm'),
(1229, '2', '29.07.2015', '19.30', 'wouter.bruynseels@hotmail.com', 0, 0, '2015-07-29 14:22:19', 'http://www.colvenier.be/');
INSERT INTO `availability` (`availability_id`, `no_person`, `dinner_date`, `dinner_hr`, `email_id`, `is_available`, `is_email`, `entrydate`, `refurl`) VALUES
(1230, '2', '05/08/2015', '19.00', 'wernergoris@skynet.be', 0, 0, '2015-07-29 17:03:03', 'http://www.colvenier.be/unieke_belevenis.htm'),
(1231, '2', '24/12/2015', '20', 'an.bekx@telenet.be', 0, 0, '2015-07-29 17:42:02', 'http://www.colvenier.be/'),
(1232, '2', '29-08-2015', '19:00', 'arie.van.loon@startmail.com', 1, 0, '2015-07-30 19:45:52', 'http://www.colvenier.be/'),
(1233, '2', '19 augustus 2015', '19u30', 'jozef.herremans@total.com', 0, 0, '2015-07-31 10:56:15', 'http://www.colvenier.be/unieke_belevenis.htm'),
(1234, '2', '15/08/2015', '19.00', 'eveline_moortgat@hotmail.com', 0, 0, '2015-07-31 11:16:11', 'http://www.colvenier.be/unieke_belevenis.htm'),
(1235, '4', '10/08/2015', '19.00', 'frank.loos@telenet.be', 1, 0, '2015-07-31 11:50:39', 'http://www.colvenier.be/'),
(1236, '4', '10 augustus 2015', '19.00', 'frank.loos@telenet.be', 1, 0, '2015-07-31 12:13:20', 'http://www.colvenier.be/unieke_belevenis.htm'),
(1237, '19u30', '8augustus', 'walter.thomaes@gmail.com', '4', 0, 0, '2015-08-02 13:26:41', 'http://www.colvenier.be/menu.htm'),
(1238, '18.30', '15-08-2015', 'luctukta@telenet.be', '2', 0, 0, '2015-08-02 14:09:31', 'http://www.colvenier.be/menu.htm'),
(1239, '40', '24.10.2015', '19:30', 'peter.schmitz@steuerschmitz.de', 1, 0, '2015-08-02 22:29:46', 'http://www.colvenier.be/'),
(1240, '2', '4/8/2015', '19:00', 'paulvanrompaey63@gmail.com', 0, 0, '2015-08-03 11:46:31', 'http://www.colvenier.be/index.php'),
(1241, '15', '31/8/2015', '19.30', 'paula.mortelmans@rentokiinitial.com', 0, 0, '2015-08-03 14:32:23', 'http://www.colvenier.be/'),
(1242, '2', '4 augustus', '19.00', 'rita.peys@telenet.be', 1, 0, '2015-08-04 09:14:31', 'http://www.colvenier.be/index.php'),
(1243, '5', '21 augustus 2015', '19 uur', 'christelcools@skynet.be', 1, 0, '2015-08-04 10:56:34', 'http://www.colvenier.be/'),
(1244, '2', '22 8 2015', '20.00', 'epc@scarlet.be', 1, 0, '2015-08-04 14:31:01', 'http://www.colvenier.be/'),
(1245, '4', '8/08/2015', '19:00', 'ivo.verrydt@telenet.be', 0, 0, '2015-08-04 16:16:30', 'http://www.colvenier.be/'),
(1246, '8', '4.8.2015', '20', 'jos.vaesen@pers.kuleuven.be', 1, 0, '2015-08-04 16:24:51', 'http://www.colvenier.be/'),
(1247, '14h', '20.09.2015', 'annemariedjh@web.de', '20 Personen', 0, 0, '2015-08-05 10:08:18', 'http://www.colvenier.be/menu.htm'),
(1248, '80-100', '5 MAART 2016', '18.00', 'HANSCUYKX@SKYNET.BE', 1, 0, '2015-08-05 20:48:10', 'http://www.colvenier.be/'),
(1249, '2', '08/08/2015', '13u30', 'mark@sca-mol.be', 0, 0, '2015-08-06 11:05:35', 'http://www.colvenier.be/'),
(1250, '2', '7-8-2015', '20:00', 'bvandecraen@telenet.be', 0, 0, '2015-08-06 13:25:07', 'http://www.colvenier.be/'),
(1251, '11:30', '7/8/15', 'sander@compoint.be', '2', 0, 0, '2015-08-06 17:26:31', 'http://www.colvenier.be/menu.htm'),
(1252, '2', '7/8/15', '12:00', 'sander@compoint.be', 1, 0, '2015-08-06 18:51:04', 'http://www.colvenier.be/'),
(1253, '2', '08-08-2015', '20:00', 'baudewijn@me.com', 1, 0, '2015-08-06 22:07:32', 'http://www.colvenier.be/'),
(1254, '6', '15/08/15', '19 uur', 'bruno.timp@telenet.be', 1, 0, '2015-08-07 11:40:34', 'http://www.colvenier.be/'),
(1255, '2', '08-08-2015', '18:30', 'werner.palinckx@telenet.be', 0, 0, '2015-08-07 20:25:30', 'http://www.colvenier.be/'),
(1256, 'Bradley', '10121985', 'dVToQBqifMW', 'djbrucho3@gmail.com', 0, 0, '2015-08-08 10:39:52', 'http://www.colvenier.be/ajax/function.mysql-query'),
(1257, '17.00 uur', '20 december 2015', 'Henpbrokx@gmail.com', '7 volwassenen', 0, 0, '2015-08-08 13:20:08', 'http://www.colvenier.be/menu.htm'),
(1258, '4', '12 augustus', '19', 'schuurmans.anda@telenet.be', 0, 0, '2015-08-08 14:02:48', 'http://www.colvenier.be/unieke_belevenis.htm'),
(1259, '3', '9/8/15', '13:00', 'dominique.gorremans@telenet.be', 0, 0, '2015-08-08 15:39:04', 'http://www.colvenier.be/'),
(1260, '2', '15 augustus', '19.00u', 'jean.dekkers@telenet.be', 1, 0, '2015-08-08 16:16:18', 'http://www.colvenier.be/'),
(1261, '2', '9/08/2015', '12.00', 'peter.willemsturnhout@gmail.com', 0, 0, '2015-08-08 22:28:54', 'http://www.colvenier.be/'),
(1262, '5', '19 sept 2015', '19:00 h', 'nicolaas.jansens@telenet.be', 1, 0, '2015-08-09 12:17:42', 'http://www.colvenier.be/?utm_source=truvo&utm_medium=internet&utm_campaign=goudengidspagesdor'),
(1263, '4', '11/8/2015', '19u30', 'liiane.vandeperre@gmail.com', 0, 0, '2015-08-09 18:24:14', 'http://www.colvenier.be/'),
(1264, 'cdAuZLZgLF', 'MkAkrqdPIhiuynL', 'QLQwFsKbjNKWLocmlbm', 'vuzjrr@oocspe.com', 0, 0, '2015-08-09 22:26:51', 'http://www.colvenier.be/sitemap.html'),
(1265, '6', '09/09/2015', '19:00', 'claus.stef@gmail.com', 1, 0, '2015-08-11 10:10:43', 'http://www.colvenier.be/'),
(1266, '14', '15/08', 'vissers.sylvia@hotmail.com', '2', 0, 0, '2015-08-11 10:53:37', 'http://www.colvenier.be/menu.htm'),
(1267, '2', '19/08/2015', '19u', 'tineke.vanheule@me.com', 0, 0, '2015-08-11 13:13:25', 'http://www.colvenier.be/index.php'),
(1268, '45', '2 september', 'vanaf 5 uur ', 'adjan@vdvliet.nl', 1, 0, '2015-08-12 10:21:24', 'http://www.colvenier.be/'),
(1269, '25', '15 september 2015', '20:00', 'e.brouns@agio.nl', 0, 0, '2015-08-12 11:39:22', 'http://www.colvenier.be/'),
(1270, '25', '15 september 2015', '20:00', 'e.brouns@agio.nl', 0, 0, '2015-08-12 13:17:39', 'http://www.colvenier.be/'),
(1271, '8', '02-10-2015', '19.00 h', 'marc.crets@skynet.be', 1, 0, '2015-08-12 13:29:43', 'http://www.colvenier.be/'),
(1272, '8', '26/09/2015', '19u30', 'sylvievanlaer@skynet.be', 1, 0, '2015-08-12 16:02:46', 'http://www.colvenier.be/'),
(1273, 'Bradley', '10121985', 'BRAPjhmfZDLeDpNfWY', 'djbrucho3@gmail.com', 0, 0, '2015-08-12 17:57:37', 'http://www.colvenier.be/'),
(1274, '19:00', '13-08-2015', 'antoon.chiers@skynet.be', '2', 0, 0, '2015-08-12 18:23:24', 'http://www.colvenier.be/menu.htm#loginForm'),
(1275, '2', '13-08-2015', '19:00', 'antoon.chiers@skynet.be', 1, 0, '2015-08-12 19:13:22', 'http://www.colvenier.be/'),
(1276, 'Bradley', '10121985', 'HmwTTDfgcfsPDWjex', 'djbrucho3@gmail.com', 0, 0, '2015-08-12 21:14:37', 'http://www.colvenier.be/actie-nieuw.html'),
(1277, '10', '08/09/2015', '19.30u', 'bnuyens@its.jnj.com', 1, 0, '2015-08-13 09:33:39', 'http://www.colvenier.be/'),
(1278, '4', '13082015', '20.00', 'koen@notarisasse.be', 0, 0, '2015-08-13 13:56:46', 'http://www.colvenier.be/'),
(1279, '2', '15 augustus 2015', '2000', 'call_0474952259@ahoo.com', 0, 0, '2015-08-13 14:37:42', 'http://www.colvenier.be/unieke_belevenis.htm'),
(1280, '14', '01/10/2015', '19u', 'ludo.elst@verz.kbc.be', 1, 0, '2015-08-14 11:15:25', 'http://www.colvenier.be/'),
(1281, '13.00', '15/08/2015', 'carldv@telenet.be', '2', 0, 0, '2015-08-15 09:48:15', 'http://www.colvenier.be/menu.htm'),
(1282, '2', '21-08-2015', '19.30 uur', 'c.c.dekruiff@amc.nl', 0, 0, '2015-08-15 15:40:46', 'http://www.colvenier.be/index.php'),
(1283, '3', '28 augustus', '19:30', 'julienne.stynen@telenet.be', 1, 0, '2015-08-16 15:24:57', 'http://www.colvenier.be/'),
(1284, '2', '24 augustus', '7 u', 'nickbuggy@hotmail.be', 0, 0, '2015-08-16 20:41:41', 'http://www.colvenier.be/'),
(1285, '2', '20-08-2015', '20:00', 'sfranka@xs4all.nl', 0, 0, '2015-08-17 09:21:12', 'http://www.colvenier.be/index.php'),
(1286, '2', '25 augustus', '19 uur', 'francis.swinnen@scarlet.be', 0, 0, '2015-08-17 17:28:59', 'http://www.colvenier.be/'),
(1287, '13.00u', '26 september', 'ncifo@hotmail.com', '13', 0, 0, '2015-08-17 20:30:12', 'http://www.colvenier.be/menu.htm'),
(1288, '13', '26-09-2015', 'ncifo@hotmail.com', '15', 0, 0, '2015-08-17 22:01:43', 'http://www.colvenier.be/menu.htm'),
(1289, '13', '26-09-2015', 'ncifo@hotmail.com', '15', 0, 0, '2015-08-17 22:02:46', 'http://www.colvenier.be/menu.htm'),
(1290, '13', '26-09-2015', 'ncifo@hotmail.com', '15', 0, 0, '2015-08-17 22:04:44', 'http://www.colvenier.be/menu.htm'),
(1291, '19.00', '20/08/2015', 'kurt.verbist@telenet.be', '2', 0, 0, '2015-08-18 13:40:54', 'http://www.colvenier.be/menu.htm'),
(1292, '20:00', '22082015', 'hagen.pm@gmail.com', '4', 0, 0, '2015-08-19 10:02:55', 'http://www.colvenier.be/menu.htm'),
(1293, '8', 'zaterdag 26 september', '19.00', 'ingrid_struyf@hotmail.com', 0, 0, '2015-08-19 11:16:58', 'http://www.colvenier.be/'),
(1294, '4', '22/8/15', '12u', 'roel@kwakkwak.be', 0, 0, '2015-08-20 10:59:30', 'http://www.colvenier.be/'),
(1295, '18 uur', '8 september 2015', 'kristel.oliviers@acv-csc.be', '8', 0, 0, '2015-08-20 14:50:33', 'http://www.colvenier.be/menu.htm'),
(1296, '10', '29/8', '20u', 'gert@wizz.be', 1, 0, '2015-08-21 13:04:55', 'http://www.colvenier.be/'),
(1297, '2', '22/08/2015', '20u00', 'ken.vanfraeyenhoven@hotmail.com', 1, 0, '2015-08-21 15:41:12', 'http://www.colvenier.be/'),
(1298, '5', '28/08/2015', '21', 'jimmyvdp@telenet.be', 0, 0, '2015-08-22 15:57:13', 'http://www.colvenier.be/'),
(1299, '5', '28/8/2015', '20u', 'jimmyvdp@telenet.be', 0, 0, '2015-08-22 15:59:26', 'http://www.colvenier.be/'),
(1300, '5 PP', 'vrijdag 25 september 2015', '20,00H', 'carine.vandoren@telenet.be', 0, 0, '2015-08-23 18:25:02', 'http://www.colvenier.be/'),
(1301, '2', '29/08/2015', '19u', 'raf@medacars.be', 1, 0, '2015-08-23 23:54:12', 'http://www.colvenier.be/'),
(1302, '21', '25/08/2015', 'kennysmets@outlook.com', '2', 0, 0, '2015-08-24 17:58:11', 'http://www.colvenier.be/menu.htm'),
(1303, '4', '13/09/2015', '19.30', 'peggy.visschers@telenet.be', 0, 0, '2015-08-24 18:24:07', 'http://www.colvenier.be/'),
(1304, '4', '12/09/2015', '19.30', 'peggy.visschers@telenet.be', 0, 0, '2015-08-24 18:25:11', 'http://www.colvenier.be/'),
(1305, '2', '28/08/2015', '19.30', 'peter.winters@wintersaviation.com', 1, 0, '2015-08-25 17:08:10', 'http://www.colvenier.be/'),
(1306, '2', '25/08/2015', '19.30', 'peter.winters@wintersaviation.com', 1, 0, '2015-08-25 17:08:31', 'http://www.colvenier.be/'),
(1307, '2 personen', '31-12-2015', 'oudejaarsavond menu', 'rita.jordens@scarlet.be', 1, 0, '2015-08-26 17:19:20', 'http://www.colvenier.be/'),
(1308, '14', '01/10/2015', '19', 'ludo.elst@verz.kbc.be', 1, 0, '2015-08-27 16:07:54', 'http://www.colvenier.be/'),
(1309, '2', '30 september 2015', '19 uur', 'fournier-sneyers@skynet.be', 0, 0, '2015-08-27 17:13:51', 'http://www.colvenier.be/getuigenissen.htm'),
(1310, '19.00', '29 augustus', 'janmennes@hotmail.com', '2', 0, 0, '2015-08-27 19:59:03', 'http://www.colvenier.be/menu.htm?utm_campaign=Colvenier%20-%20Grootse%20heropening%20met%20culinair%20festijn%21&utm_source=restocheck.com&utm_medium=email#reservForm'),
(1311, '20.30u', '28/08/2015', 'f-j@telenet.be', '2', 0, 0, '2015-08-28 11:02:27', 'http://www.colvenier.be/menu.htm#loginForm'),
(1312, '20', '31-08-2015', '5', 'youriverschoor@hotmail.com', 0, 0, '2015-08-28 11:49:25', 'http://www.colvenier.be/'),
(1313, '2', '29.8.2015', '20.00', 'jan.geerts@proximedia.be', 0, 0, '2015-08-29 18:24:17', 'http://www.colvenier.be/'),
(1314, '2', '29.8.2015', '20.30', 'jan.geerts@proximedia.be', 0, 0, '2015-08-29 18:40:36', 'http://www.colvenier.be/index.php'),
(1315, '7', '19 september 2015', '8 uur', 'maudkallen@gmail.com', 0, 0, '2015-08-29 21:59:39', 'http://www.colvenier.be/unieke_belevenis.htm'),
(1316, '20.00', '5 september 2015', 'optiekann@skynet.be', '2', 0, 0, '2015-09-01 10:35:49', 'http://www.colvenier.be/menu.htm#loginForm'),
(1317, '2', '4 september', '19u', 'tonyborms@gmail.com', 1, 0, '2015-09-01 11:56:18', 'http://www.colvenier.be/'),
(1318, '2', '1 september', '20.00', 'pepijnjanssen@hotmail.nl', 0, 0, '2015-09-01 15:21:54', 'http://www.colvenier.be/'),
(1319, '2', '2 sept.2015', '12u30', 'jan.wouters110@telenet.be', 1, 0, '2015-09-01 15:57:41', 'http://www.colvenier.be/'),
(1320, '2', '02092015', '19.30', 'jellebolsens@gmail.com', 0, 0, '2015-09-01 19:27:03', 'http://www.colvenier.be/'),
(1321, '19.00', '05/09/15', 'fb578386@skynet.be', '2', 0, 0, '2015-09-01 19:29:08', 'http://www.colvenier.be/menu.htm#reservForm'),
(1322, '10', '13/11/2015', '18u30', 'katlijn.vanacker@borealisgroup.com', 1, 0, '2015-09-02 11:35:11', 'http://www.colvenier.be/'),
(1323, '2', '5 september 2015', '19:30', 'wim.noome@gmail.com', 0, 0, '2015-09-02 12:49:26', 'http://www.colvenier.be/'),
(1324, '2', '28-11-2015', '20:00 uur', 'fulcodonus@kpnplanet.nl', 0, 0, '2015-09-03 12:06:56', 'http://www.colvenier.be/index.php'),
(1325, '6', '17/09/2015', '12:00', 'michael.lauwers@portofantwerp.com', 1, 0, '2015-09-03 14:01:40', 'http://www.colvenier.be/index.php'),
(1326, '2', '08/09/2015', '19.30', 'luckysport@telenet.be', 1, 0, '2015-09-03 16:10:14', 'http://www.colvenier.be/'),
(1327, '6', '24 oktober', '19,00 u', 'dgeudens1@telenet.be', 1, 0, '2015-09-03 18:04:45', 'http://www.colvenier.be/'),
(1328, '4', '06.09.2015', '13.00 uur', 'dmondelaers@wijngaardnatie.be', 1, 0, '2015-09-04 09:42:22', 'http://www.colvenier.be/'),
(1329, '4', '18/09/2015', '19', 'meurant@skynet.be', 1, 0, '2015-09-04 12:44:31', 'http://www.colvenier.be/'),
(1330, '4', '19/09/2015', '19', 'meurant@skynet.be', 1, 0, '2015-09-04 12:44:59', 'http://www.colvenier.be/'),
(1331, '2', '5.9.15', '12.30', 'mcvanpeteghem@yahoo.com', 1, 0, '2015-09-04 16:23:38', 'http://www.colvenier.be/'),
(1332, '2', '6-9-2015', '20u', 'essie181181@hotmail.com', 0, 0, '2015-09-05 10:49:29', 'http://www.colvenier.be/index.php'),
(1333, '2', '28-11-2015', '20:00 uur', 'fulcodonus@kpnplanet.nl', 0, 0, '2015-09-05 13:45:58', 'http://www.colvenier.be/video.htm'),
(1334, '14', '09.10.2015', '20.00', 'tillyfriedrichs@hotmail.com', 1, 0, '2015-09-06 17:07:06', 'http://www.colvenier.be/'),
(1335, '3', '08/09', '19u30', 'pjacobsardo@gmail.com', 0, 0, '2015-09-07 11:16:51', 'http://www.colvenier.be/'),
(1336, '', 'x', '', 'y', 0, 0, '2015-09-07 18:15:49', 'http://www.colvenier.be/'),
(1337, '2', '12-09', '20.00', 'drik.en.nicole@gmail.com', 0, 0, '2015-09-07 21:32:51', 'http://www.colvenier.be/getuigenissen.htm'),
(1338, '6', '16/09/2015', '19.30 - 20.00 ', 'chantal.heylen@norkring.be', 1, 0, '2015-09-08 08:52:31', 'http://www.colvenier.be/'),
(1339, '20u', '12/09/2015', 'johan.breugelmans@agent.beobank.be', '2', 0, 0, '2015-09-08 11:13:17', 'http://www.colvenier.be/menu.htm'),
(1340, '19u', '18/09/2015', 'meurant@skynet.be', '4', 0, 0, '2015-09-08 12:18:09', 'http://www.colvenier.be/menu.htm#loginForm'),
(1341, '5', '25 september', '21.00', 'Karin.Nys@scarlet.be', 1, 0, '2015-09-08 21:41:59', 'http://www.colvenier.be/'),
(1342, '19.30u', '18/09/2015', 'sunantachotinet@hotmail.com', '2-4', 0, 0, '2015-09-09 12:58:52', 'http://www.colvenier.be/menu.htm'),
(1343, '2', '15/09/2015', '20', 'pascal.gybels@luiknatie.be', 0, 0, '2015-09-09 14:48:58', 'http://www.colvenier.be/unieke_belevenis.htm'),
(1344, '6', '10/09/15', '19.30', 'MARK.LAUREYNS@AMPLIFON.COM', 1, 0, '2015-09-10 16:01:22', 'http://www.colvenier.be/'),
(1345, '4', '3 oktober 2015', '19:00', 'elsleys@telenet.be', 1, 0, '2015-09-10 17:27:15', 'http://www.colvenier.be/unieke_belevenis.htm'),
(1346, '19u', '17-10-2015', 'plomp.cindy@gmail.com', '4', 0, 0, '2015-09-11 14:54:21', 'http://www.colvenier.be/menu.htm'),
(1347, '2', '12/09/2015', '19:00', 'dag_ken@hotmail.com', 0, 0, '2015-09-12 15:35:00', 'http://www.colvenier.be/'),
(1348, '2', '12/9/2015', '19:00', 'dag_ken@hotmail.com', 0, 0, '2015-09-12 15:47:27', 'http://www.colvenier.be/index.php'),
(1349, '3', '13/09/2015', '13.00', 'van.stevens.w@telenet.be', 1, 0, '2015-09-12 19:55:51', 'http://www.colvenier.be/'),
(1350, '2', '29 sept', '7 uur', 'johanstes@hotmail.com', 0, 0, '2015-09-12 22:38:21', 'http://www.colvenier.be/'),
(1351, '5', '25 september', '21.00', 'Karin.Nys@scarlet.be', 1, 0, '2015-09-13 12:03:55', 'http://www.colvenier.be/'),
(1352, '2', '13-09-2015', '20:00', 'giovannimailleur@gmail.com', 0, 0, '2015-09-13 16:47:12', 'http://www.colvenier.be/'),
(1353, '2', '19/09/2015', '18:00', 'sarah_ceulemans@hotmail.com', 1, 0, '2015-09-14 13:31:49', 'http://www.colvenier.be/'),
(1354, '4', '18.09.15', '13.00', 'gg@organi.be', 0, 0, '2015-09-14 15:06:54', 'http://www.colvenier.be/unieke_belevenis.htm'),
(1355, '4', '17092015', '18:00', 'apers.linne@hotmail.com', 1, 0, '2015-09-14 19:58:09', 'http://www.colvenier.be/'),
(1356, '4', '04/12/2015', '12.30 uur', 'wema.verzekeringen@portima.be', 1, 0, '2015-09-15 12:51:17', 'http://www.colvenier.be/'),
(1357, '1', '17 9 /2015', '1', 'nicole.dufeu@post-co.com', 1, 0, '2015-09-15 13:20:19', 'http://www.colvenier.be/'),
(1358, '7', '27/10/2015', '19', 'diana.schaaders@vanin.be', 0, 0, '2015-09-15 14:13:33', 'http://www.colvenier.be/unieke_belevenis.htm'),
(1359, '13', '20/09/2015', 'fonssimk@gmail.com', '4', 0, 0, '2015-09-15 20:51:33', 'http://www.colvenier.be/menu.htm#loginForm'),
(1360, '18', '20/09/2015', 'fonssimk@gmail.com', '4', 0, 0, '2015-09-15 20:51:50', 'http://www.colvenier.be/menu.htm#loginForm'),
(1361, '18', '19/09/2015', 'fonssimk@gmail.com', '4', 0, 0, '2015-09-15 20:53:17', 'http://www.colvenier.be/menu.htm#loginForm'),
(1362, '5', '05/10/2015', '12:00', 'makemyday@telenet.be', 0, 0, '2015-09-15 21:03:16', 'http://www.colvenier.be/'),
(1363, '12', '21/11/2015', '18:30', 'jpdewolf@precitool-fenwick.be', 1, 0, '2015-09-16 10:26:10', 'http://www.colvenier.be/unieke_belevenis.htm'),
(1364, '4', '18/09/2015', '20.00', 'kris.cloots@be.issworld.com', 0, 0, '2015-09-16 11:32:13', 'http://www.colvenier.be/'),
(1365, '2', '31-12-2015', '19.00 ', 'wimvessen@tiscali.nl', 0, 0, '2015-09-17 10:03:41', 'http://www.colvenier.be/'),
(1366, '9', '30-09-2015', '19:00', 'ilse.van-opstal@basf.com', 1, 0, '2015-09-17 15:45:49', 'http://www.colvenier.be/index.php'),
(1367, '8', '30/11/15', '20.OOH', 'christine.adriaenssens@telenet.be', 0, 0, '2015-09-18 09:17:10', 'http://www.colvenier.be/'),
(1368, '19', '19 september', 'bambiehome@telenet.be', '2', 0, 0, '2015-09-19 15:25:01', 'http://www.colvenier.be/menu.htm#loginForm'),
(1369, '2', '2/10/2015', '19u', 'vanderstappenanja@hotmail.com', 1, 0, '2015-09-20 10:58:42', 'http://www.colvenier.be/?utm_source=truvo&utm_medium=internet&utm_campaign=goudengidspagesdor'),
(1370, '2 personen', '7 november', '19:30', 'blommont@planet.nl', 0, 0, '2015-09-21 22:31:06', 'http://www.colvenier.be/'),
(1371, '2', '3/10/15', '18u30', 'Bianca.Fieuw@so.antwerpen.be', 1, 0, '2015-09-22 13:53:49', 'http://www.colvenier.be/index.php'),
(1372, '9', '21-11-2015', '19', 'Jean.vinck@outlook.com', 1, 0, '2015-09-22 16:41:43', 'http://www.colvenier.be/'),
(1373, '2', '23/10/2015', '19.00 - 19.30', 'pc@transparantinvest.be', 0, 0, '2015-09-23 12:10:02', 'http://www.colvenier.be/index.php'),
(1374, '2', '23/10/2015', '20u', 'verhulst.manu@telenet.be', 1, 0, '2015-09-23 14:53:31', 'http://www.colvenier.be/'),
(1375, '2', '25-12-2015', '19.30', 'j.mulders@muldersbouw.nl', 0, 0, '2015-09-24 08:00:36', 'http://www.colvenier.be/index.php'),
(1376, '4', '24/09/15', '19.15', 'marleenaka@hotmail.com', 1, 0, '2015-09-24 13:16:42', 'http://www.colvenier.be/'),
(1377, '4', '27/10/2015', '13U-1330', '--guido.schelfhout@telenet.be', 0, 0, '2015-09-25 11:32:46', 'http://www.colvenier.be/'),
(1378, '19 h', '30 september 2015', 'veemulder@gmail.com', '3', 0, 0, '2015-09-25 11:48:59', 'http://www.colvenier.be/menu.htm'),
(1379, '6 personen', 'vrijdag 9 oktober 2015', '13 uur', 'annieb@skynet.be', 1, 0, '2015-09-26 12:49:36', 'http://www.colvenier.be/'),
(1380, '3', '16 oktober 2015', '18h00', 'jef.horemans@bpost.be', 1, 0, '2015-09-28 07:47:34', 'http://www.colvenier.be/'),
(1381, '2', '17 oktober', '20.00', 'rmichielsen@vanasadvocaten.nl', 0, 0, '2015-09-28 15:51:24', 'http://www.colvenier.be/'),
(1382, '4', '31-12-2015', '19.00', 'debetswillem@gmail.com', 0, 0, '2015-09-28 19:36:57', 'http://www.colvenier.be/'),
(1383, '3', '30 september 2015', '19 u', 'veemulder@gmail.com', 1, 0, '2015-09-28 23:11:43', 'http://www.colvenier.be/'),
(1384, '4', '30/09/15', '20.30', 'christvdp@gmail.com', 0, 0, '2015-09-29 13:43:46', 'http://www.colvenier.be/'),
(1385, '10', '31/10/2015', '19.00', 'vda.willy@ahd-installatiebedrijf.be', 0, 0, '2015-09-30 09:26:49', 'http://www.colvenier.be/'),
(1386, 'Johnb414', 'iwrtwrtu', 'erwieuyo', 'johnb397@gmail.com', 0, 0, '2015-09-30 12:32:09', 'http://www.colvenier.be/getuigenissen.htm'),
(1387, 'Johnb392', 'iwrtwrtu', 'erwieuyo', 'johnb411@gmail.com', 0, 0, '2015-09-30 12:32:39', 'http://www.colvenier.be/getuigenissen.htm'),
(1388, '19.00uur', 'vrijdag 2 oktober 2015', 'marijke.van.leenen@hccnet.nl', '2', 0, 0, '2015-09-30 13:32:57', 'http://www.colvenier.be/menu.htm'),
(1389, '20:00', '03/10/2015', 'peter190972@hotmail.com', '4', 0, 0, '2015-09-30 15:06:56', 'http://www.colvenier.be/menu.htm#loginForm'),
(1390, '4', '31-12-2015', '19.00', 'info@praktijkreconnect.nl', 0, 0, '2015-09-30 16:04:46', 'http://www.colvenier.be/'),
(1391, '2', '03-10-2015', '20.00 - 20.30', 'pascalejongejans@gmail.com', 1, 0, '2015-09-30 20:48:16', 'http://www.colvenier.be/unieke_belevenis.htm'),
(1392, '2', '03 okt 2015', '19.00 - 19.15 uur', 'rogerdesmedt36@gmail.com', 1, 0, '2015-09-30 21:25:38', 'http://www.colvenier.be/'),
(1393, '2', '03/10/2015', '19 u', 'paulcools1@telenet.be', 1, 0, '2015-09-30 22:59:53', 'http://www.colvenier.be/'),
(1394, '6', '12-12-2015', '20.00 uur', 'f.wognum@athloneextrusions.nl', 1, 0, '2015-10-01 15:39:33', 'http://www.colvenier.be/'),
(1395, '2', '03 oktober', '20.00', 'rudy@vlaamsekinderopvang.be', 1, 0, '2015-10-02 09:21:18', 'http://www.colvenier.be/'),
(1396, '2', '2 oktober', '19.30', 'wagemakerjanpc@gmail.com', 1, 0, '2015-10-02 09:30:16', 'http://www.colvenier.be/'),
(1397, '2', '03 oktober 2015', '20.30', 'rudy@vlaamsekinderopvang.be', 1, 0, '2015-10-02 10:08:49', 'http://www.colvenier.be/unieke_belevenis.htm'),
(1398, '19:00 +-', '17-10-2015', 'wpietermaat@hotmail.com', '2', 0, 0, '2015-10-02 10:19:36', 'http://www.colvenier.be/menu.htm'),
(1399, '3', '19/10/2015', '12u30', 'joris.bours@cotac-group.com', 0, 0, '2015-10-02 11:21:39', 'http://www.colvenier.be/'),
(1400, '3', '4 november', '12.00u', 'd-lydia@hotmail.com', 1, 0, '2015-10-02 12:55:23', 'http://www.colvenier.be/index.php'),
(1401, '3', '4nov', '12.30', 'd-lydia@hotmail.com', 1, 0, '2015-10-02 13:22:22', 'http://www.colvenier.be/index.php'),
(1402, '3', '9 oktober 2015', '19 uur', 'veemulder@gmail.com', 1, 0, '2015-10-02 20:27:36', 'http://www.colvenier.be/unieke_belevenis.htm'),
(1403, '3', '10 oktober 2015', '19 u', 'veemulder@gmail.com', 1, 0, '2015-10-02 20:29:09', 'http://www.colvenier.be/unieke_belevenis.htm'),
(1404, '3', '6 oktober 2015', '19 u', 'veemulder@gmail.com', 1, 0, '2015-10-02 20:30:25', 'http://www.colvenier.be/unieke_belevenis.htm'),
(1405, '5', 'kerstdag', '12h', 'luc.folders@me.com', 0, 0, '2015-10-04 10:34:57', 'http://www.colvenier.be/unieke_belevenis.htm'),
(1406, '3', '9 oktober 2015', '19 h', 'veemulder@gmail.com', 1, 0, '2015-10-04 12:10:03', 'http://www.colvenier.be/'),
(1407, '4', '19 oktober', '12.00 uur', 'h.reijs@rotterdamengineering.nl', 0, 0, '2015-10-04 12:27:08', 'http://www.colvenier.be/index.php'),
(1408, '4', '08/10/2015', '18.00u', 'mark_jennings_jp@yahoo.com', 0, 0, '2015-10-04 19:30:23', 'http://www.colvenier.be/unieke_belevenis.htm'),
(1409, '3', '08-10-2015', '12.30', 'jan.henderieckx@telenet.be', 1, 0, '2015-10-04 20:35:25', 'http://www.colvenier.be/'),
(1410, '100', '4 MAART 2016', '20 UUR', 'INFO@COLVENIER.BE', 1, 0, '2015-10-05 12:36:46', 'http://www.colvenier.be/'),
(1411, '2', '10-10-2015', '18u30', 'karinverschueren8@hotmail.com', 1, 0, '2015-10-05 14:26:30', 'http://www.colvenier.be/'),
(1412, '2', '18/11/2015', '18h30', 'willem.spaepen@hotmail.com', 1, 0, '2015-10-05 20:23:12', 'http://www.colvenier.be/'),
(1413, '20 Uur', '23 december 2015', 'roosdaubioul@gmail.com', '5', 0, 0, '2015-10-06 10:03:03', 'http://www.colvenier.be/menu.htm'),
(1414, '19:00', '8 november 2015', 'leonardjonkers@hotmail.com', '4', 0, 0, '2015-10-06 11:40:26', 'http://www.colvenier.be/menu.htm?utm_source=colvenier&utm_medium=email&utm_campaign=0415'),
(1415, '3', '16.10.2015', '12', 'karin.verelst@hotmail.com', 0, 0, '2015-10-06 13:06:29', 'http://www.colvenier.be/index.php'),
(1416, '19.00', '09/10/2015', 'django@hollants.be', '2', 0, 0, '2015-10-06 15:53:27', 'http://www.colvenier.be/menu.htm'),
(1417, '2', '07/10/15', '19u30', 'info@caslan.be', 0, 0, '2015-10-06 17:18:03', 'http://www.colvenier.be/'),
(1418, '19:30 uur', '10-10-2015', 'robtoebes66@gmail.com', '8', 0, 0, '2015-10-06 17:22:54', 'http://www.colvenier.be/menu.htm#loginForm'),
(1419, '2', '07-10-2015', '20.00', 'erwin.vandeneynden@me.com', 1, 0, '2015-10-06 22:09:37', 'http://www.colvenier.be/'),
(1420, '18u30', '7/10/2015', 'stephanie.vervynckt@eu.umicore.com', '13', 0, 0, '2015-10-07 09:57:21', 'http://www.colvenier.be/menu.htm'),
(1421, '10', '28 nov 2015', '20.00', 'mb7mls@gmail.com', 0, 0, '2015-10-07 10:40:04', 'http://www.colvenier.be/index.php'),
(1422, '2', '23/08/2015', '18:00', 'matthijssens.jozef@gmail.com', 1, 0, '2015-10-07 11:12:55', 'http://www.colvenier.be/'),
(1423, '3', '07/10', '19.00', 'mating_p@yahoo.com', 1, 0, '2015-10-07 11:21:58', 'http://www.colvenier.be/'),
(1424, '2', '8 oktober 2015', '18.30', 'amvandusseldorp@kpnmail.nl', 1, 0, '2015-10-07 13:35:50', 'http://www.colvenier.be/index.php'),
(1425, '12 u', ' dinsdag 20 okt', 'dhaese.sonja@skynet.be', '4', 0, 0, '2015-10-07 14:51:31', 'http://www.colvenier.be/menu.htm'),
(1426, '2', '23/10/2015', '18:00', 'matthijssens.jozef@gmail.com', 1, 0, '2015-10-07 15:05:54', 'http://www.colvenier.be/'),
(1427, '19', '10/10/2015', 'dffg@ddf.com', '2', 0, 0, '2015-10-07 16:08:31', 'http://www.colvenier.be/menu.htm?utm_source=colvenier&utm_medium=email&utm_campaign=0415'),
(1428, '2', '19/10/2015', '8u', 'ludodriesen3@hotmail.com', 0, 0, '2015-10-07 18:10:56', 'http://www.colvenier.be/'),
(1429, '20', '2/1/2106', 'freddy.bartholomeus@telenet.be', '2', 0, 0, '2015-10-07 18:24:54', 'http://www.colvenier.be/menu.htm?utm_source=colvenier&utm_medium=email&utm_campaign=0415#loginForm'),
(1430, '2', '20/10/2015', '12:00', 'jefmatt@hotmail.com', 1, 0, '2015-10-08 10:42:50', 'http://www.colvenier.be/'),
(1431, '2', '2015-10-10', '1900', 'rob@stillekens.com', 1, 0, '2015-10-08 14:02:35', 'http://www.colvenier.be/'),
(1432, '8', '10 oktober', '20u', 'marcdeturck@msn.com', 0, 0, '2015-10-08 17:31:22', 'http://www.colvenier.be/unieke_belevenis.htm'),
(1433, '4', '17/10/2015', '20.00', 'kristvc@hotmail.com', 1, 0, '2015-10-08 23:50:49', 'http://www.colvenier.be/'),
(1434, '2', '9 oktober', '20:00', 'kay@tangomuziek.nl', 0, 0, '2015-10-09 13:00:55', 'http://www.colvenier.be/unieke_belevenis.htm'),
(1435, '2', '10/10', '18.30', 'vogelaers.walter@skynet.be', 1, 0, '2015-10-09 16:56:06', 'http://www.colvenier.be/'),
(1436, '4', '17/10/2015', '19', 'kristof@kristofwillekens.com', 0, 0, '2015-10-09 18:24:06', 'http://www.colvenier.be/'),
(1437, '18:00u', '10-10-15', 'raba@telenet.be', '2', 0, 0, '2015-10-09 21:41:45', 'http://www.colvenier.be/menu.htm?utm_source=colvenier&utm_medium=email&utm_campaign=0415#loginForm'),
(1438, '2', '10/10/2015', '20', 'phunixx@gmail.com', 0, 0, '2015-10-10 11:40:14', 'http://www.colvenier.be/'),
(1439, '14', '03/12/2015', '19:30', 'jaimina.el.jadir@telenet.be', 1, 0, '2015-10-10 14:32:54', 'http://www.colvenier.be/unieke_belevenis.htm'),
(1440, '4', '27-12', '19u', 'lea@starrenhof.be', 1, 0, '2015-10-10 20:18:27', 'http://www.colvenier.be/unieke_belevenis.htm'),
(1441, '6', '31122015', '20 uur', 'theofever@hotmail.com', 0, 0, '2015-10-11 12:16:45', 'http://www.colvenier.be/unieke_belevenis.htm'),
(1442, '2', '25 december 2015', '19.30 uur', 'henri.laurent@telenet.be', 0, 0, '2015-10-11 23:14:27', 'http://www.colvenier.be/'),
(1443, '11', '31/10/2015', '19.00u', 'willy-vda@btnr.be', 1, 0, '2015-10-12 14:06:49', 'http://www.colvenier.be/'),
(1444, '2', '31-12-2015', '19.30', 'ankeverbruggen@hotmail.com', 0, 0, '2015-10-12 15:24:04', 'http://www.colvenier.be/index.php'),
(1445, '4', '16/10/2005', '19:00', 'raymond.dennes@telenet.be', 0, 0, '2015-10-12 22:27:09', 'http://www.colvenier.be/'),
(1446, '2', '14-10-2015', '20:00', 'eddy_van_meir@hotmail.com', 1, 0, '2015-10-13 13:21:23', 'http://www.colvenier.be/'),
(1447, '2', '03/11/2015', '19u', 'wim.mannaert@skynet.be', 1, 0, '2015-10-13 15:04:11', 'http://www.colvenier.be/index.php'),
(1448, '3', '14/10/2015', '19.30', 'BERT.PEETERS@SCANIA.COM', 0, 0, '2015-10-13 19:01:30', 'http://www.colvenier.be/unieke_belevenis.htm'),
(1449, '2 ', '17-10-2015', '19u30', 'dirk.de.schutter3@telenet.be', 1, 0, '2015-10-13 19:32:13', 'http://www.colvenier.be/'),
(1450, '2', '14-10-2015', '20:00', 'eddy_van_meir@hotmail.com', 1, 0, '2015-10-13 20:31:38', 'http://www.colvenier.be/'),
(1451, '12', '28 nov 2015', '20.00', 'marc_baert@fujifilm-ffem.com', 1, 0, '2015-10-14 09:22:47', 'http://www.colvenier.be/'),
(1452, '6', '14 november 2015', '19:00', 'peterdupont@telenet.be', 1, 0, '2015-10-14 15:27:36', 'http://www.colvenier.be/'),
(1453, '2', '25/10//2015', '19u', 'anne.hauloy@telenet.be', 1, 0, '2015-10-14 18:09:41', 'http://www.colvenier.be/getuigenissen.htm'),
(1454, '4', '19-11-2015', '18:00', 'casperjaco@live.nl', 1, 0, '2015-10-14 19:45:48', 'http://www.colvenier.be/'),
(1455, '4', '20-11-2015', '18:00', 'casperjaco@live.nl', 1, 0, '2015-10-14 19:47:03', 'http://www.colvenier.be/'),
(1456, '6', '14 november 2015', '19:00', 'peterdupont@telenet.be', 1, 0, '2015-10-14 20:32:31', 'http://www.colvenier.be/'),
(1457, '4', '19-11-2015', '18:30', 'casperjaco@live.nl', 1, 0, '2015-10-14 21:47:13', 'http://www.colvenier.be/'),
(1458, '2', '16/10', '13', 'pashidis@hotmail.com', 0, 0, '2015-10-15 14:31:29', 'http://www.colvenier.be/index.php'),
(1459, '4', '18/10/2015', '18:30', 'krishendrix@telenet.be', 0, 0, '2015-10-15 15:27:18', 'http://www.colvenier.be/'),
(1460, '13', '16/10', 'frans.van.lint@skynet.be', '2', 0, 0, '2015-10-15 17:14:24', 'http://www.colvenier.be/menu.htm'),
(1461, '4', '24.12.2015', '18.30', 'dvtger@icloud.com', 0, 0, '2015-10-15 18:24:46', 'http://www.colvenier.be/'),
(1462, '30', '20/8/2016', '18:30', 'harry_koebrugge@hotmail.com', 0, 0, '2015-10-16 12:33:25', 'http://www.colvenier.be/'),
(1463, '20u00', '16/10', 'wesleyprincen@skynet.be', '2', 0, 0, '2015-10-16 18:22:51', 'http://www.colvenier.be/menu.htm'),
(1464, '2', '17/10/15', '19:00', 'fvboven@telenet.be', 1, 0, '2015-10-16 22:32:08', 'http://www.colvenier.be/'),
(1465, '15', '19/11/2015', '19.30', 'murphi@telenet.be', 0, 0, '2015-10-17 10:26:00', 'http://www.colvenier.be/unieke_belevenis.htm'),
(1466, '2', '01/01/2016', '19 uur', 'karin_kievit@hotmail.com', 1, 0, '2015-10-17 11:58:40', 'http://www.colvenier.be/'),
(1467, '2', '18/10/2015', '19.30', 'michelyseboot@gmail.com', 1, 0, '2015-10-18 11:15:56', 'http://www.colvenier.be/'),
(1468, '2', '18/10/2015', '19.00', 'michelyseboot@gmail.ccom', 0, 0, '2015-10-18 11:17:28', 'http://www.colvenier.be/'),
(1469, '19.00', '03/12/2015', 'vogelaers.walter@skynet.be', '4', 0, 0, '2015-10-18 12:41:41', 'http://www.colvenier.be/menu.htm'),
(1470, '2', '18/10/2015', '1900', 'v.d.bergh.nicole@gmail.com', 0, 0, '2015-10-18 17:43:40', 'http://www.colvenier.be/'),
(1471, '3', '23 oktober 2015', '19h30', 'info@studio-zen-nin.be', 1, 0, '2015-10-19 14:17:04', 'http://www.colvenier.be/'),
(1472, '18.30', '27.10.2015', 'julien.mastbooms@telenet.be', '3', 0, 0, '2015-10-19 14:24:38', 'http://www.colvenier.be/menu.htm'),
(1473, '4', '6 novempber 2015', '19u30', 'jappie.six@telenet.be', 1, 0, '2015-10-19 16:36:28', 'http://www.colvenier.be/'),
(1474, '4', '30 oktober 2015', '19u30', 'jappie.six@telenet.be', 1, 0, '2015-10-19 16:39:20', 'http://www.colvenier.be/'),
(1475, '4', '28/10/2015', '20:00', 'stefan.deridder@thomsonreuters.com', 0, 0, '2015-10-19 16:45:06', 'http://www.colvenier.be/'),
(1476, '13.00', '30 10 2015', 'mvantilborg@skynet.be', '4', 0, 0, '2015-10-19 22:42:04', 'http://www.colvenier.be/menu.htm'),
(1477, '18:30', '20/10/2015', 'elisabeth.dutt@live.be', '2', 0, 0, '2015-10-20 00:46:40', 'http://www.colvenier.be/menu.htm'),
(1478, '2', '22/10/2015', '20', 'vincentdaelemans@hotmail.be', 1, 0, '2015-10-20 12:41:04', 'http://www.colvenier.be/index.php'),
(1479, '2', '24 oktober', '19.30 uur', 'pietengea@hetnet.nl', 1, 0, '2015-10-20 16:21:48', 'http://www.colvenier.be/'),
(1480, '2', '25/10/2015', '1900', 'michelyseboot@gmail.com', 0, 0, '2015-10-21 09:19:51', 'http://www.colvenier.be/'),
(1481, '3', '6/11/2015', '12,00 u', 'gally@telenet.be', 0, 0, '2015-10-21 10:21:14', 'http://www.colvenier.be/unieke_belevenis.htm'),
(1482, '6', '14 november 2015', '19u', 'rita.heremans@gmail.com', 1, 0, '2015-10-21 12:37:42', 'http://www.colvenier.be/'),
(1483, '3', '23/10/2015', '12 u30', 'luc.coppens@kava.be', 1, 0, '2015-10-21 12:38:43', 'http://www.colvenier.be/unieke_belevenis.htm'),
(1484, '3', '29 oktober', '19:00-19:30', 'philip@vejavino.be', 1, 0, '2015-10-21 13:42:06', 'http://www.colvenier.be/'),
(1485, '19.30- 20.00', '31/10/2015', 'krisjanssens@advocaat.be', '8', 0, 0, '2015-10-21 14:51:03', 'http://www.colvenier.be/menu.htm?utm_source=colvenier&utm_medium=email&utm_campaign=0415#reservForm'),
(1486, '5', '24 12 2015', '19.00', 'roger.van.brusselen@telenet.be', 0, 0, '2015-10-21 16:22:54', 'http://www.colvenier.be/'),
(1487, '19.30', '24/10/2015', 'jl.vcutsem@scarlet.be', '9', 0, 0, '2015-10-21 16:42:59', 'http://www.colvenier.be/menu.htm'),
(1488, '19', '22102015', 'peter.depotter@kdg.be', '2', 0, 0, '2015-10-22 09:48:47', 'http://www.colvenier.be/menu.htm'),
(1489, '19', '22102015', 'peter.depotter@kdg.be', '2', 0, 0, '2015-10-22 09:48:49', 'http://www.colvenier.be/menu.htm'),
(1490, '6', '24 oktober 2015', '18.30', 'tinebeer@gmail.com', 0, 0, '2015-10-22 09:55:42', 'http://www.colvenier.be/unieke_belevenis.htm'),
(1491, '2 ', '23 10 2015 ', '20 uur ', 'helenmetdepenningen@telenet.be', 0, 0, '2015-10-22 13:25:54', 'http://www.colvenier.be/'),
(1492, '2', '31 -12 2015', '19.30', 'kors.van.bruinisse@aon.nl', 0, 0, '2015-10-22 13:50:27', 'http://www.colvenier.be/'),
(1493, '2', '23/10/2015', '19.30 u', 'mobile@robacardio.be', 1, 0, '2015-10-22 22:26:57', 'http://www.colvenier.be/'),
(1494, '4', '31-12-2015', '20.00 hr', 'paulwarnier@telenet.be', 0, 0, '2015-10-22 22:50:13', 'http://www.colvenier.be/'),
(1495, '4', 'dinsdag 27 oktober 2015', 'omstreeks 13:00 u', 'jean.pillet@skynet.be', 1, 0, '2015-10-23 12:56:20', 'http://www.colvenier.be/'),
(1496, '4', '30 10 2015 ', '12 30', 'marc.van.tilborg@brusselsairport.be', 0, 0, '2015-10-23 18:16:45', 'http://www.colvenier.be/index.php'),
(1497, 'Bradley', '10121985', 'lbwEabGvyTn', 'lucas2d44@gmail.com', 0, 0, '2015-10-24 05:17:38', 'http://www.colvenier.be/'),
(1498, '4', '18/12/2015', '18.30', 'ludo.peeters1@telenet.be', 1, 0, '2015-10-24 17:51:06', 'http://www.colvenier.be/'),
(1499, '2', '13-11-2015', '19:00', 'are.van.loon@startmail.com', 1, 0, '2015-10-24 19:09:33', 'http://www.colvenier.be/'),
(1500, '2', '27/12', '19u', 'vackerma@msn.com', 0, 0, '2015-10-25 16:00:49', 'http://www.colvenier.be/unieke_belevenis.htm'),
(1501, '19 uur', '7 dec 2015', 'astridh@telenet.be', '6', 0, 0, '2015-10-25 16:26:33', 'http://www.colvenier.be/menu.htm'),
(1502, '4', '18/12/2015', '20.00', 'vogelaers.walter@skynet.be', 1, 0, '2015-10-25 20:27:57', 'http://www.colvenier.be/'),
(1503, '4', '9/12/2015', '19.30', 'vogelaers.walter@skynet.be', 1, 0, '2015-10-25 20:34:45', 'http://www.colvenier.be/'),
(1504, '2', '1 november 2015', '20.30 uur', 'irisbrik@finetuning.nl', 1, 0, '2015-10-25 21:42:59', 'http://www.colvenier.be/index.php'),
(1505, '3', '31/10/2015', '17:30', 'selekpl@yahoo.com', 0, 0, '2015-10-26 09:44:03', 'http://www.colvenier.be/'),
(1506, '6', '18/10/2015', '19:30', 'aertsmarijke@gmail.com', 1, 0, '2015-10-26 13:51:16', 'http://www.colvenier.be/unieke_belevenis.htm'),
(1507, '6', '18/11/2015', '19:30', 'aertsmarijke@gmail.com', 1, 0, '2015-10-26 13:59:10', 'http://www.colvenier.be/index.php'),
(1508, '19:30', '07112015', 'info@colvenier.be', '4', 0, 0, '2015-10-26 15:03:03', 'http://www.colvenier.be/menu.htm'),
(1509, '4', '30/10/2015', '19', 'mmaes@telenet.be', 0, 0, '2015-10-27 14:12:37', 'http://www.colvenier.be/unieke_belevenis.htm'),
(1510, '13.00 u', '29102015', 'roger.tasseel@skynet.be', '2', 0, 0, '2015-10-27 15:37:19', 'http://www.colvenier.be/menu.htm?utm_source=colvenier&utm_medium=email&utm_campaign=0515'),
(1511, '19.30', '7 november 20', 'annvankets@gmail.com', '2', 0, 0, '2015-10-27 15:58:46', 'http://www.colvenier.be/menu.htm?utm_source=colvenier&utm_medium=email&utm_campaign=0515'),
(1512, '2', '28102015', '19', 'guido.godde@gmail.com', 1, 0, '2015-10-27 16:43:37', 'http://www.colvenier.be/'),
(1513, '3', '31.10.2015', '19', 'luc.hogers@scarlet.be', 1, 0, '2015-10-27 16:55:44', 'http://www.colvenier.be/'),
(1514, '2', '28/10:15', '12.30', 'marc.schrauwen@wiresteel.be', 1, 0, '2015-10-27 17:51:27', 'http://www.colvenier.be/'),
(1515, '20', '31/10', 'koffiepotje@telenet.be', '2', 0, 0, '2015-10-27 18:48:39', 'http://www.colvenier.be/menu.htm?utm_source=colvenier&utm_medium=email&utm_campaign=0515'),
(1516, '2', '27 november 2015', '19.30', 'bart.norma@freeler.nl', 1, 0, '2015-10-27 19:49:14', 'http://www.colvenier.be/'),
(1517, '5', '5/12/2015', '19:30', 'sfdsklmt@kgkls.be', 0, 0, '2015-10-27 20:29:08', 'http://www.colvenier.be/index.php'),
(1518, '2', '3 januari 2016', '19.00uut', 'hubert.buysse@gmail.com', 1, 0, '2015-10-27 20:36:56', 'http://www.colvenier.be/index.php'),
(1519, '20h30', '31-10-2015', 'katsiris@hotmail.Be', '2', 0, 0, '2015-10-27 22:18:46', 'http://www.colvenier.be/menu.htm'),
(1520, '20u', '28/10/2015', 'alex_mesmaekers@hotmail.com', '2', 0, 0, '2015-10-28 10:23:41', 'http://www.colvenier.be/menu.htm?utm_source=colvenier&utm_medium=email&utm_campaign=0515'),
(1521, '19:30', '07/11', 'christiaan.van-den-bergh@basf.com', '2', 0, 0, '2015-10-28 12:48:17', 'http://www.colvenier.be/menu.htm'),
(1522, '2', '10 november 2015', '20u', 'johan_de_paep@hotmail.com', 0, 0, '2015-10-28 13:12:51', 'http://www.colvenier.be/'),
(1523, '20h00', '30/10/2015', 'patrick.verdonck@ing.be', '2', 0, 0, '2015-10-28 15:45:20', 'http://www.colvenier.be/menu.htm?utm_source=colvenier&utm_medium=email&utm_campaign=0515'),
(1524, '6', '18/11/2015', '19:00', 'aertsmarijke@gmail.com', 1, 0, '2015-10-28 15:59:29', 'http://www.colvenier.be/'),
(1525, '6', '17/11/2015', '19:00', 'aertsmarijke@gmail.com', 1, 0, '2015-10-28 16:01:52', 'http://www.colvenier.be/'),
(1526, '6', '20/11/2015', '19:00', 'aertsmarijke@gmail.com', 1, 0, '2015-10-28 16:02:08', 'http://www.colvenier.be/'),
(1527, '6', '02/11', '19u', 'els_de_ridder@msn.com', 0, 0, '2015-10-28 16:33:52', 'http://www.colvenier.be/'),
(1528, '4', '31/10/2015', '20 uur', 'lea.debock@gmail.com', 1, 0, '2015-10-28 17:19:16', 'http://www.colvenier.be/'),
(1529, '5', '05-12-2015', '19:00', 'francois_boubal@hotmail.com', 1, 0, '2015-10-28 18:11:28', 'http://www.colvenier.be/unieke_belevenis.htm'),
(1530, '2', '31/10/2015', '19 uur', 'jolien.de.vriese@hotmail.com', 0, 0, '2015-10-28 18:21:53', 'http://www.colvenier.be/'),
(1531, '5', '27/11/2015', '20', 'walter.verhesen@telenet.be', 1, 0, '2015-10-28 20:14:08', 'http://www.colvenier.be/'),
(1532, '4', '30/11/2015', '16.00', 'eurovissport@telenet.be', 1, 0, '2015-10-29 08:02:40', 'http://www.colvenier.be/'),
(1533, '2', '30/10/2015', '20', 'chris.keersmaekers@belgacom.net', 1, 0, '2015-10-29 10:39:51', 'http://www.colvenier.be/'),
(1534, '15  20', '4 december', '12 u - lunch', 'martine.snijder@nelsoninspires.be', 0, 0, '2015-10-29 11:51:59', 'http://www.colvenier.be/unieke_belevenis.htm'),
(1535, '6', '21/11/2015', '19:00', 'aertsmarijke@gmail.com', 1, 0, '2015-10-29 13:51:24', 'http://www.colvenier.be/'),
(1536, '19.00 uusr', '21/11/2015', 'nancy-guy@telenet.be', '4', 0, 0, '2015-10-29 15:03:28', 'http://www.colvenier.be/menu.htm'),
(1537, '18 uur', '16 december 2015', 'freddy_alpaerts@hotmail.be', '2', 0, 0, '2015-10-30 11:32:56', 'http://www.colvenier.be/menu.htm'),
(1538, '40', '8 januari', '18u', 'marina.heuvelmans@skynet.be', 0, 0, '2015-10-30 12:24:43', 'http://www.colvenier.be/'),
(1539, '50', '8 januari', '18u', 'marina.heuvelmans@skynet.be', 0, 0, '2015-10-30 12:24:57', 'http://www.colvenier.be/'),
(1540, '60', '8 januari', '18u', 'marina.heuvelmans@skynet.be', 0, 0, '2015-10-30 12:25:04', 'http://www.colvenier.be/'),
(1541, '2', '30/10/2015', '19u', 'verhulst.manu@telenet.be', 1, 0, '2015-10-30 13:51:22', 'http://www.colvenier.be/'),
(1542, '19uur30', '14/11/2015', 'roland.vanlierde@scarlet.be', '5', 0, 0, '2015-10-30 14:49:06', 'http://www.colvenier.be/menu.htm'),
(1543, '19uur30', '14/11/2015', 'roland.vanlierde@scarlet.be', '5', 0, 0, '2015-10-30 14:49:09', 'http://www.colvenier.be/menu.htm'),
(1544, '4 personen', '08/01/2016', '20:00', 'janien.goetemans@telenet.be', 1, 0, '2015-10-30 18:07:35', 'http://www.colvenier.be/'),
(1545, '2', '07/11/2015', '19.30', 'calluy.gyproc@hotmail.be', 0, 0, '2015-10-31 13:08:13', 'http://www.colvenier.be/'),
(1546, '2', '31 oktober', '19.15', 'rhermans1953@gmail.com', 1, 0, '2015-10-31 13:23:24', 'http://www.colvenier.be/'),
(1547, '18:00', '2/11/2015', 'roger@rogerfrans.be', '2', 0, 0, '2015-10-31 14:05:22', 'http://www.colvenier.be/menu.htm?utm_source=colvenier&utm_medium=email&utm_campaign=0515#loginForm'),
(1548, '2', '31 10 15', '19.30u', 'meesherman@skynet.be', 0, 0, '2015-10-31 15:17:00', 'http://www.colvenier.be/unieke_belevenis.htm'),
(1549, '2', '13-11-2015', '20:00', 'geveha@hotmail.com', 1, 0, '2015-10-31 18:06:45', 'http://www.colvenier.be/'),
(1550, '19 00 h', '19 / 12', 'eugeen.de.smet@telenet.be', '9', 0, 0, '2015-10-31 18:48:59', 'http://www.colvenier.be/menu.htm?utm_source=colvenier&utm_medium=email&utm_campaign=0515'),
(1551, '19 00 h', '19 / 12', 'eugeen.de.smet@telenet.be', '9', 0, 0, '2015-10-31 18:54:17', 'http://www.colvenier.be/menu.htm?utm_source=colvenier&utm_medium=email&utm_campaign=0515'),
(1552, '5', '14/11/2015', '19 uut', 'roland.vanlierde@scarlet.be', 1, 0, '2015-11-01 09:30:41', 'http://www.colvenier.be/'),
(1553, '19', '14/11/2015', 'roland.vanlierde@scarlet.be', '5', 0, 0, '2015-11-01 09:46:44', 'http://www.colvenier.be/menu.htm'),
(1554, '2', '31-12-2015', 'diner', 'i.lodders@upcmail.nl', 0, 0, '2015-11-01 10:08:10', 'http://www.colvenier.be/'),
(1555, '2', '6/11/2015', '19:00', 'eddy_aerts@skynet.be', 1, 0, '2015-11-01 21:29:55', 'http://www.colvenier.be/'),
(1556, '2', '7-11-2015', '20.00', 'hvleent@gmail.com', 1, 0, '2015-11-02 17:11:52', 'http://www.colvenier.be/'),
(1557, '19u', '06/11/2015', 'elsvanhoof@outlook.com', '2', 0, 0, '2015-11-02 17:42:40', 'http://www.colvenier.be/menu.htm'),
(1558, '19.00 uur', '14112015', 'L.Wehmeijer@xs4all.nl', '5', 0, 0, '2015-11-03 11:05:39', 'http://www.colvenier.be/menu.htm'),
(1559, '19 uur', 'zaterdag 23 januari 2016', 'paulrosylegrand@telenet.be', '18', 0, 0, '2015-11-03 13:42:13', 'http://www.colvenier.be/menu.htm'),
(1560, '2', '7 november 2015', '1900', 'luc.wils@hotmail.com', 0, 0, '2015-11-03 15:08:35', 'http://www.colvenier.be/unieke_belevenis.htm'),
(1561, '4', '7 november 2015', '1900', 'luc.wils@hotmail.com', 0, 0, '2015-11-03 15:10:03', 'http://www.colvenier.be/unieke_belevenis.htm'),
(1562, '6', '7 november 2015', '1900', 'luc.wils@hotmail.com', 0, 0, '2015-11-03 15:10:26', 'http://www.colvenier.be/unieke_belevenis.htm'),
(1563, '20', '14-11-2015', '19u00', 'birgit@walraet.org', 1, 0, '2015-11-03 15:52:36', 'http://www.colvenier.be/'),
(1564, '4', '5/11/2015', '19U00', 'nathaliewuyts@live.be', 1, 0, '2015-11-03 16:11:23', 'http://www.colvenier.be/'),
(1565, '+-20u.', '18 december 2015', 'gerarddewalque@msn.com', '2', 0, 0, '2015-11-03 22:43:39', 'http://www.colvenier.be/menu.htm'),
(1566, '4', '13/11/2015', '19.30', 'luccosters@hotmail.com', 1, 0, '2015-11-04 07:58:24', 'http://www.colvenier.be/'),
(1567, '1800', '10/11/15', 'dorien_vandoninck@hotmail.com', '2', 0, 0, '2015-11-04 14:07:04', 'http://www.colvenier.be/menu.htm'),
(1568, '19.30', '21/11/2015', 'rogerpeeters41@hotmail.com', '4', 0, 0, '2015-11-04 14:40:35', 'http://www.colvenier.be/menu.htm'),
(1569, '4', '25/11/2015', '18', 'jef@trappeniers.be', 0, 0, '2015-11-04 15:08:47', 'http://www.colvenier.be/'),
(1570, 'VIER', '27-11-2015', '13:00 UUR', 'verschraegen.herman@gmail.com', 1, 0, '2015-11-04 15:15:11', 'http://www.colvenier.be/index.php'),
(1571, '2', '13/12/15', '19.00', 'erik@quartzline.nl', 1, 0, '2015-11-04 16:55:44', 'http://www.colvenier.be/unieke_belevenis.htm'),
(1572, '3', '20/11/15', '20.00', 'g.vaneijck@brggroep.nl', 0, 0, '2015-11-04 20:25:26', 'http://www.colvenier.be/unieke_belevenis.htm'),
(1573, '19:30', '20/11/15', 'kempenaers.jan@hotmail.com', '2', 0, 0, '2015-11-04 23:10:40', 'http://www.colvenier.be/menu.htm'),
(1574, '2', '21/11/2015', '19:00', 'jacques.schrauwen@telenet.be', 1, 0, '2015-11-05 08:33:11', 'http://www.colvenier.be/'),
(1575, '19h', '02/01/2016', 'freddy.bartholomeus@telenet.be', '2', 0, 0, '2015-11-05 09:47:39', 'http://www.colvenier.be/menu.htm?utm_source=colvenier&utm_medium=email&utm_campaign=0415'),
(1576, '5', '9/12/2015', '18u30', 'info@unipool.be', 1, 0, '2015-11-05 10:25:58', 'http://www.colvenier.be/unieke_belevenis.htm'),
(1577, '2', '31-12-2015', '20.00', 'dh@financialassets.nl', 0, 0, '2015-11-05 11:30:17', 'http://www.colvenier.be/'),
(1578, '2', '07-11-2015', '19:30', 'emrekalkan190782@gmail.com', 0, 0, '2015-11-05 12:56:27', 'http://www.colvenier.be/'),
(1579, '2', '31.12.2015', '19', 'hugojansen@telenet.be', 0, 0, '2015-11-05 15:52:21', 'http://www.colvenier.be/'),
(1580, '19:30', '13 NOVEMBER 2015', 'johnnvw@gmail.com', '2', 0, 0, '2015-11-06 16:06:51', 'http://www.colvenier.be/menu.htm'),
(1581, '4', '7 november', '8', 'charmaineischellehut@gmail.com', 1, 0, '2015-11-07 17:03:27', 'http://www.colvenier.be/'),
(1582, '1900', '08112015', 'juripolis@telenet.be', '2', 0, 0, '2015-11-07 19:17:46', 'http://www.colvenier.be/menu.htm'),
(1583, '2', '08112015', '1830', 'juripolis@telenet.be', 1, 0, '2015-11-07 21:40:59', 'http://www.colvenier.be/'),
(1584, '4', '14 november', '18 u', 'leaware@live.be', 0, 0, '2015-11-08 10:23:17', 'http://www.colvenier.be/unieke_belevenis.htm'),
(1585, '2', '25 december', '19.30', 'irmaknipknap@hotmail.com', 1, 0, '2015-11-08 11:41:31', 'http://www.colvenier.be/index.php'),
(1586, '2', '25 december kerst', '19.30', 'irmaknipknap@hotmail.com', 1, 0, '2015-11-08 11:51:37', 'http://www.colvenier.be/index.php'),
(1587, '2', '24.12.2015', '19u30', 'walter.thomaes@gmail.com', 1, 0, '2015-11-08 12:00:37', 'http://www.colvenier.be/'),
(1588, '12.00', '03-12-2015', 'petra.van.lommen@hotmail.com', '2', 0, 0, '2015-11-08 13:48:50', 'http://www.colvenier.be/menu.htm'),
(1589, 'lunch', '25 december 2015', 'postema45@vodafonethuis.nl', '2', 0, 0, '2015-11-08 13:49:29', 'http://www.colvenier.be/menu.htm'),
(1590, '5', '28/11/2015', '19u30', 'bob.baete01@skynet.be', 1, 0, '2015-11-09 01:50:34', 'http://www.colvenier.be/'),
(1591, '40', '08/01/2016', '19:00', 'm.heuvelmans@intercool.be', 1, 0, '2015-11-09 10:58:40', 'http://www.colvenier.be/'),
(1592, '40', '08/01/2016', '19:00', 'm.heuvelmans@intercool.be', 1, 0, '2015-11-09 13:10:55', 'http://www.colvenier.be/unieke_belevenis.htm'),
(1593, '17.30', '13/11/2015', 'dirk@abbico-services.be', '2', 0, 0, '2015-11-09 21:40:03', 'http://www.colvenier.be/menu.htm?utm_source=colvenier&utm_medium=email&utm_campaign=0515'),
(1594, '2', '31-12-2015', '19.00 uur', 'm-a.lankhorst@ziggo.nl', 0, 0, '2015-11-09 23:13:33', 'http://www.colvenier.be/'),
(1595, '2', '14 November 2015', '19.30', 'siswatieni@yahoo.com', 1, 0, '2015-11-10 09:36:32', 'http://www.colvenier.be/'),
(1596, 'uur19', 'december', 'maryseverschelden@yahoo.com', '4', 0, 0, '2015-11-11 12:42:38', 'http://www.colvenier.be/menu.htm'),
